event_date,buy_date,topic,topic_display,instrument,post_count,avg_sentiment,sentiment_label,total_engagement,platform,headline_text,buy_price,presidency_era,in_office,return_1d_pct,value_1d,return_1w_pct,value_1w,return_1m_pct,value_1m
2014-09-11,2014-09-11,oil_energy,Oil & Energy,oil,2,0.4617,positive,10481,Twitter,Tell Saudi Arabia and others that we want (demand!) free oil for the next ten years or we will not protect their private Boeing 747s.Pay up!,92.83,Not President (Pre-2017),Not In Office,-0.6033,99396.75,0.2585,100258.54,-7.6376,92362.38
2014-09-17,2014-09-17,oil_energy,Oil & Energy,oil,1,0.3382,positive,215,Twitter,Must read article by @boonepickens & @AmbJohnBolton: “America’s Untapped Energy Weapon” http://www.politico.com/magazine/story/2014/08/americas-untapped-energy-weapon-109676.html#.VBmzE5RdW8A … We don't need foreign oil!,94.42,Not President (Pre-2017),Not In Office,-1.4298,98570.22,-1.7157,98284.26,-12.3597,87640.33
2014-09-19,2014-09-19,oil_energy,Oil & Energy,oil,1,0.5267,positive,542,Twitter,China's the leading exporter of Iraqi oil yet they won’t lift a finger against ISIS. Why should we do the heavy lifting for China’s gain?,92.41,Not President (Pre-2017),Not In Office,-0.9631,99036.9,1.2228,101222.81,-10.4967,89503.3
2014-09-22,2014-09-22,oil_energy,Oil & Energy,oil,1,0.5707,positive,113,Twitter,"From rags to riches, and back to rags! http://www.nytimes.com/2014/09/22/us/heirs-to-an-oil-fortune-join-the-divestment-drive.html?_r=0 …",91.52,Not President (Pre-2017),Not In Office,0.0437,100043.71,3.3326,103332.6,-12.0192,87980.77
2014-10-09,2014-10-09,oil_energy,Oil & Energy,oil,1,0.3182,positive,1061,Twitter,"Right now 4000 U.S. troops are stupidly heading to West Africa to help fight Ebola.No help from China, Russia or wealthy African oil nations",85.77,Not President (Pre-2017),Not In Office,0.0583,100058.3,-3.5793,96420.66,-9.7587,90241.34
2014-10-24,2014-10-24,oil_energy,Oil & Energy,oil,1,-0.5983,negative,658,Twitter,"Saudis just cut oil supply,making prices rise “immediately” while we are fighting ISIS for them http://www.bloomberg.com/news/2014-10-23/saudi-arabia-said-to-cut-crude-oil-supply-to-market-in-september.html?hootPostID=85412050974d86b20b6b79b103db2107 … What are we doing!",81.01,Not President (Pre-2017),Not In Office,-0.0123,99987.66,-0.5802,99419.82,-6.456,93544.01
2014-10-29,2014-10-29,oil_energy,Oil & Energy,oil,1,-0.2023,negative,61,Twitter,"""@TheRealPWeight: You did say that when we leave bad guys will take the oil in Iraq.. ISIS controls a lot of it today. Good foresight.""",82.2,Not President (Pre-2017),Not In Office,-1.3139,98686.13,-4.2822,95717.76,-19.5255,80474.45
2014-10-30,2014-10-30,oil_energy,Oil & Energy,oil,1,-0.644,negative,142,Twitter,Chinese oil trader just bought “record number” of Mideast crude http://www.bloomberg.com/news/2014-10-28/chinese-oil-trader-buys-record-number-of-mideast-cargoes.html#disqus_thread?hootPostID=69bba9a379db6263f0005fb54c720cff … China gains while we fight ISIS. What are we doing?,81.12,Not President (Pre-2017),Not In Office,-0.715,99285.01,-3.9571,96042.9,-14.9408,85059.17
2014-11-08,2014-11-10,oil_energy,Oil & Energy,oil,1,0.4199,positive,897,Twitter,"Do not go back into Iraq unless they agree, in a signed formal instrument, to give the U.S. 50% of their oil reserves.Make the deal dummies!",77.4,Not President (Pre-2017),Not In Office,0.0,100000.0,-2.2739,97726.1,-18.5401,81459.95
2014-11-09,2014-11-10,oil_energy,Oil & Energy,oil,1,0.4574,positive,205,Twitter,"Remember, we don't get any oil from Iraq, China gets whatever ISIS hasn't already taken. So why isn't China sending the troops? Too smart!",77.4,Not President (Pre-2017),Not In Office,0.0,100000.0,-2.2739,97726.1,-17.5452,82454.78
2014-11-28,2014-11-28,oil_energy,Oil & Energy,oil,1,0.3818,positive,72,Twitter,"""@twins44: @realDonaldTrump I think you are responsible for lower gas prices, only you had the balls to call out OPEC. Thank you Mr. Trump""",66.15,Not President (Pre-2017),Not In Office,4.3084,104308.39,-0.4686,99531.37,-18.9569,81043.08
2014-11-29,2014-12-01,oil_energy,Oil & Energy,oil,2,-0.4555,negative,157,Twitter,"""@KraftyWurker: #Trump is the only potential Presidential candidate who has been demanding and threatening to get lower oil & gas prices.",69.0,Not President (Pre-2017),Not In Office,0.0,100000.0,-8.6232,91376.81,-22.3043,77695.65
2014-12-01,2014-12-01,oil_energy,Oil & Energy,oil,2,-0.072,negative,295,Twitter,".@WhoopiGoldberg Don’t let @Rosie speak badly of you or try to bring you down. She is rude, crude & not smart. She is not in your league.",69.0,Not President (Pre-2017),Not In Office,-3.0725,96927.54,-8.6232,91376.81,-22.7971,77202.9
2014-12-10,2014-12-10,oil_energy,Oil & Energy,oil,1,0.6544,positive,29,Twitter,"""@PianoBecca: @realDonaldTrump already lowered the high gas prices next he will restore America's greatness! And no stupid windmills!!""",60.94,Not President (Pre-2017),Not In Office,-1.6245,98375.45,-7.3351,92664.92,-20.6433,79356.74
2015-01-21,2015-01-21,oil_energy,Oil & Energy,oil,2,-0.4415,negative,413,Twitter,"If Scotland would have gone independent predicated on $100 - $150 oil, they would now be bust!",47.78,Not President (Pre-2017),Not In Office,-3.0766,96923.4,-6.9694,93030.56,5.3579,105357.89
2015-01-23,2015-01-23,oil_energy,Oil & Energy,oil,1,-0.5256,negative,65,Twitter,"With oil below $50, the blighted views by windfarms of historic @CulzeanCastle will be very sad. #SaveCulzean pic.twitter.com/wQSIPBlv3o",45.59,Not President (Pre-2017),Not In Office,-0.9651,99034.88,5.8127,105812.68,8.4668,108466.77
2015-02-19,2015-02-19,oil_energy,Oil & Energy,oil,1,0.4019,positive,94,Twitter,Via @businessinsider by @BKcolin: “Donald Trump called the White House and offered to help fix the BP oil spill” http://www.businessinsider.com/donald-trump-wanted-to-help-fix-the-bp-oil-spill-2015-2#ixzz3SEfZFCwY …,51.16,Not President (Pre-2017),Not In Office,-1.6028,98397.19,-5.8444,94155.59,-7.2518,92748.24
2015-03-26,2015-03-26,oil_energy,Oil & Energy,oil,1,0.1516,positive,2749,Twitter,"If Saudi Arabia, which has been making one billion dollars a day from oil, wants our help and protection, they must pay dearly! NO FREEBIES.",51.43,Not President (Pre-2017),Not In Office,-4.9776,95022.36,-4.4527,95547.35,10.8108,110810.81
2015-04-02,2015-04-02,oil_energy,Oil & Energy,oil,1,0.3794,positive,1239,Twitter,"Oil is under $50/barrel. Now is the time to increase sanctions against Iran, not lift them. No deal is better than a bad deal. #ArtOfTheDeal",49.14,Not President (Pre-2017),Not In Office,6.105,106105.01,3.3578,103357.75,19.9227,119922.67
2015-04-20,2015-04-20,oil_energy,Oil & Energy,oil,1,0.6988,positive,41,Twitter,"""@suttera2: @realDonaldTrump They'll repay us by giving us higher gas prices!"" True!",56.38,Not President (Pre-2017),Not In Office,-1.9865,98013.48,1.0819,101081.94,4.6116,104611.56
2015-05-07,2015-05-07,oil_energy,Oil & Energy,oil,1,-0.6623,negative,183,Twitter,"""@jrondatampier: If Obama isnt able to solve Baltimore´s issue, no chance to solve China´s & OPEC´s abuses. The World asks for leadership!",58.94,Not President (Pre-2017),Not In Office,0.7635,100763.49,1.5948,101594.84,-1.3573,98642.69
2015-05-12,2015-05-12,oil_energy,Oil & Energy,oil,1,-0.7003,negative,77,Twitter,"""@cerrabella: @realDonaldTrump China to build military base in Africa next to critical choke oil transport- zerohedge http://www.zerohedge.com/news/2015-05-10/china-open-military-base-horn-africa-next-critical-oil-transit-choke-point …",60.75,Not President (Pre-2017),Not In Office,-0.4115,99588.48,-5.7449,94255.14,0.0329,100032.92
2015-06-29,2015-06-29,oil_energy,Oil & Energy,oil,1,0.0,neutral,128,Twitter,"""@BrittainShannon: @realDonaldTrump @AlWaleedbinT Or at least give it back in oil""",58.33,Not President (Pre-2017),Not In Office,1.9544,101954.4,-9.9434,90056.57,-16.3552,83644.78
2015-08-18,2015-08-18,oil_energy,Oil & Energy,oil,1,-0.296,negative,12713,Twitter,If I am elected President I will immediately approve the Keystone XL pipeline. No impact on environment & lots of jobs for U.S.,42.62,Not President (Pre-2017),Not In Office,-4.2703,95729.7,-7.7663,92233.69,10.0422,110042.23
2015-11-06,2015-11-06,oil_energy,Oil & Energy,oil,2,-0.2461,negative,13571,Twitter,"So sad that Obama rejected Keystone Pipeline. Thousands of jobs, good for the environment, no downside!",44.29,Not President (Pre-2017),Not In Office,-0.9483,99051.7,-8.0154,91984.65,-14.9921,85007.9
2015-11-13,2015-11-13,oil_energy,Oil & Energy,oil,2,0.1954,positive,39939,Twitter,They laughed at me when I said to bomb the ISIS controlled oil fields. Now they are not laughing and doing what I said. #Trump2016,40.74,Not President (Pre-2017),Not In Office,2.4546,102454.59,-0.8591,99140.89,-10.8738,89126.17
2015-11-15,2015-11-16,oil_energy,Oil & Energy,oil,2,-0.4318,negative,9256,Twitter,"""@thewatcher23579: One of Paris terrorist came as Syrian refugee. Donald Trump is right again. BOMB THEIR OIL - TAKE AWAY THEIR FUNDING""",41.74,Not President (Pre-2017),Not In Office,0.0,100000.0,0.024,100023.96,-10.5175,89482.51
2015-11-16,2015-11-16,oil_energy,Oil & Energy,oil,1,-0.4404,negative,15745,Twitter,"Remember, I was the one who said attack the oil (ISIS source of wealth) a long time ago. Everyone scoffed, now they're attacking the oil.",41.74,Not President (Pre-2017),Not In Office,-2.5635,97436.51,0.024,100023.96,-14.9018,85098.23
2015-11-22,2015-11-23,oil_energy,Oil & Energy,oil,1,-0.3091,negative,2652,Twitter,"""@iliveamongyou: URGENT “@GOP…in an effort to destroy their own front runner.” #MakeAmericaGreatAgain http://www.breitbart.com/big-government/2015/11/20/keystone-cops-gop-consultant-class-heroes-publicly-panhandling-desperate-bid-derail-donald-trump/ …"" I HIT BACK!",41.75,Not President (Pre-2017),Not In Office,0.0,100000.0,-0.2395,99760.48,-13.4371,86562.87
2015-12-07,2015-12-07,oil_energy,Oil & Energy,oil,1,0.3612,positive,8304,Twitter,Should have gone after the oil years ago (like I have been saying).,37.65,Not President (Pre-2017),Not In Office,-0.3718,99628.15,-3.5591,96440.9,-9.7742,90225.76
2015-12-09,2015-12-09,oil_energy,Oil & Energy,oil,1,-0.5848,negative,2924,Twitter,"""@mysteriousLoser: @realDonaldTrump did you hear the mayor nutter of philadelphias comments towards you? Ignorance"" Yes, he is a crude dope!",37.16,Not President (Pre-2017),Not In Office,-1.0764,98923.57,-4.4133,95586.65,-10.7643,89235.74
2015-12-18,2015-12-18,oil_energy,Oil & Energy,oil,1,-0.5411,negative,11643,Twitter,#ISIS is making $400M/year on oil. I have been saying it for years. We need to bomb the oil! https://www.facebook.com/DonaldTrump/posts/10156425109365725 … pic.twitter.com/teKBaKdXzK,34.73,Not President (Pre-2017),Not In Office,0.0288,100028.79,5.9891,105989.06,-18.0536,81946.44
2016-01-03,2016-01-04,oil_energy,Oil & Energy,oil,1,0.0,neutral,6371,Twitter,"Iran, with all of the money and all else given to them by Obama, has wanted a way to take over Saudi Arabia & their oil. THEY JUST FOUND IT!",36.76,Not President (Pre-2017),Not In Office,0.0,100000.0,-14.5539,85446.14,-18.716,81284.0
2016-01-22,2016-01-22,oil_energy,Oil & Energy,oil,1,-0.5255,negative,5104,Twitter,"After spending $89 million, @JebBush is at the bottom of the barrel in polls. He is ashamed to use the name ""Bush"" in ads. Low energy guy!",32.19,Not President (Pre-2017),Not In Office,-5.7471,94252.87,4.4424,104442.37,-2.2057,97794.35
2016-02-28,2016-02-29,oil_energy,Oil & Energy,oil,1,-0.4019,negative,9467,Twitter,"While I hear the Koch brothers are in big financial trouble (oil), word is they have chosen little Marco Rubio, the lightweight from Florida",33.75,Not President (Pre-2017),Not In Office,0.0,100000.0,12.2963,112296.3,13.4222,113422.22
2016-03-12,2016-03-14,oil_energy,Oil & Energy,oil,1,0.1984,positive,12981,Twitter,"Ohio had the biggest budget increase in the U.S. If it were not for striking oil, they would be bust! Governor Kasich in favor of TPP fraud!",37.18,Not President (Pre-2017),Not In Office,0.0,100000.0,7.3427,107342.66,8.553,108552.99
2016-03-24,2016-03-24,oil_energy,Oil & Energy,oil,1,-0.3802,negative,24300,Twitter,"It is amazing how often I am right, only to be criticized by the media. Illegal immigration, take the oil, build the wall, Muslims, NATO!",39.46,Not President (Pre-2017),Not In Office,-0.1774,99822.61,-2.8383,97161.68,8.0588,108058.79
2016-06-03,2016-06-03,oil_energy,Oil & Energy,oil,1,0.6249,positive,7192,Twitter,"After @TrumpTurnberry I will be visiting Aberdeen, the oil capital of Europe, to see my great club, @TrumpScotland.",48.62,Not President (Pre-2017),Not In Office,2.2007,102200.74,0.9255,100925.55,-4.1547,95845.33
2017-01-24,2017-01-24,oil_energy,Oil & Energy,oil,1,0.0,neutral,135465,Twitter,Signing orders to move forward with the construction of the Keystone XL and Dakota Access pipelines in the Oval Office. pic.twitter.com/OErGmbBvYK – at The Oval Office,53.18,President — 1st Term (2017–2021),In Office,-0.8086,99191.43,-0.6958,99304.25,2.3881,102388.12
2017-06-11,2017-06-12,oil_energy,Oil & Energy,oil,1,-0.2946,negative,103978,Twitter,The #FakeNews MSM doesn't report the great economic news since Election Day. #DOW up 16%. #NASDAQ up 19.5%. Drilling & energy sector...,46.08,President — 1st Term (2017–2021),In Office,0.0,100000.0,-4.0799,95920.14,-2.2569,97743.06
2017-07-04,2017-07-05,oil_energy,Oil & Energy,oil,1,-0.3802,negative,163303,Twitter,Gas prices are the lowest in the U.S. in over ten years! I would like to see them go even lower.,45.13,President — 1st Term (2017–2021),In Office,0.0,100000.0,-0.1994,99800.58,8.6417,108641.7
2017-07-29,2017-07-31,oil_energy,Oil & Energy,oil,1,-0.7793,negative,68953,Twitter,"In other words, Russia was against Trump in the 2016 Election - and why not, I want strong military & low oil prices. Witch Hunt! https://twitter.com/foxandfriends/status/890848095424180225 …",50.17,President — 1st Term (2017–2021),In Office,0.0,100000.0,-1.5547,98445.29,-7.1756,92824.4
2017-10-15,2017-10-16,oil_energy,Oil & Energy,oil,1,0.908,positive,77813,Twitter,"...approvals of The Keystone XL & Dakota Access pipelines. Also, look at the recent EPA cancelations & our great new Supreme Court Justice!",51.87,President — 1st Term (2017–2021),In Office,0.0,100000.0,0.0578,100057.84,7.3838,107383.84
2017-12-28,2017-12-28,oil_energy,Oil & Energy,oil,1,-0.7726,negative,133518,Twitter,Caught RED HANDED - very disappointed that China is allowing oil to go into North Korea. There will never be a friendly solution to the North Korea problem if this continues to happen!,59.84,President — 1st Term (2017–2021),In Office,0.9693,100969.25,3.6263,103626.34,9.5588,109558.82
2018-04-20,2018-04-20,oil_energy,Oil & Energy,oil,1,-0.3159,negative,104448,Twitter,"Looks like OPEC is at it again. With record amounts of Oil all over the place, including the fully loaded ships at sea, Oil prices are artificially Very High! No good and will not be accepted!",68.38,President — 1st Term (2017–2021),In Office,0.3802,100380.23,-0.4095,99590.52,5.6449,105644.93
2018-06-06,2018-06-06,oil_energy,Oil & Energy,oil,1,-0.3612,negative,92983,Twitter,"...This is a level of criminality beyond the pale. This is such a grave abuse of power and authority, it’s like nothing else we’ve seen in our history. This makes the Nixon Watergate burglary look like keystone cop stuff",64.73,President — 1st Term (2017–2021),In Office,1.8848,101884.75,2.9507,102950.72,14.0121,114012.05
2018-06-13,2018-06-13,oil_energy,Oil & Energy,oil,1,-0.4015,negative,116305,Twitter,"Oil prices are too high, OPEC is at it again. Not good!",66.64,President — 1st Term (2017–2021),In Office,0.3752,100375.15,-0.6303,99369.75,6.5576,106557.62
2018-06-22,2018-06-22,oil_energy,Oil & Energy,oil,1,0.6696,positive,65440,Twitter,Hope OPEC will increase output substantially. Need to keep prices down!,68.58,President — 1st Term (2017–2021),In Office,-0.7291,99270.92,8.1219,108121.9,-1.0061,98993.88
2018-06-30,2018-07-02,oil_energy,Oil & Energy,oil,1,0.3578,positive,168627,Twitter,"Just spoke to King Salman of Saudi Arabia and explained to him that, because of the turmoil & disfunction in Iran and Venezuela, I am asking that Saudi Arabia increase oil production, maybe up to 2,000,000 barrels, to make up the difference...Prices to high! He has agreed!",73.94,President — 1st Term (2017–2021),In Office,0.0,100000.0,-0.1217,99878.28,-5.1528,94847.17
2018-07-04,2018-07-05,oil_energy,Oil & Energy,oil,1,0.6719,positive,121307,Twitter,"The OPEC Monopoly must remember that gas prices are up & they are doing little to help. If anything, they are driving prices higher as the United States defends many of their members for very little $’s. This must be a two way street. REDUCE PRICING NOW!",72.94,President — 1st Term (2017–2021),In Office,0.0,100000.0,-3.5097,96490.27,-6.1009,93899.1
2018-07-11,2018-07-11,oil_energy,Oil & Energy,oil,1,-0.8713,negative,86214,Twitter,"Billions of additional dollars are being spent by NATO countries since my visit last year, at my request, but it isn’t nearly enough. U.S. spends too much. Europe’s borders are BAD! Pipeline dollars to Russia are not acceptable!",70.38,President — 1st Term (2017–2021),In Office,-0.071,99928.96,-2.3018,97698.21,-3.9074,96092.64
2018-07-12,2018-07-12,oil_energy,Oil & Energy,oil,1,0.6621,positive,91787,Twitter,"....On top of it all, Germany just started paying Russia, the country they want protection from, Billions of Dollars for their Energy needs coming out of a new pipeline from Russia. Not acceptable! All NATO Nations must meet their 2% commitment, and that must ultimately go to 4%!",70.33,President — 1st Term (2017–2021),In Office,0.9669,100966.87,-1.237,98762.97,-4.4504,95549.55
2018-07-26,2018-07-26,oil_energy,Oil & Energy,oil,1,0.6588,positive,95300,Twitter,"European Union representatives told me that they would start buying soybeans from our great farmers immediately. Also, they will be buying vast amounts of LNG!",69.61,President — 1st Term (2017–2021),In Office,-1.3216,98678.35,-0.9338,99066.23,-1.0631,98936.93
2018-09-20,2018-09-20,oil_energy,Oil & Energy,oil,1,0.1969,positive,88496,Twitter,"We protect the countries of the Middle East, they would not be safe for very long without us, and yet they continue to push for higher and higher oil prices! We will remember. The OPEC monopoly must get prices down now!",70.8,President — 1st Term (2017–2021),In Office,-0.0282,99971.75,1.8644,101864.41,-2.3023,97697.74
2018-11-12,2018-11-12,oil_energy,Oil & Energy,oil,1,0.2874,positive,81041,Twitter,"Hopefully, Saudi Arabia and OPEC will not be cutting oil production. Oil prices should be much lower based on supply!",59.93,President — 1st Term (2017–2021),In Office,-7.0749,92925.08,-5.2895,94710.5,-14.6504,85349.57
2018-11-21,2018-11-21,oil_energy,Oil & Energy,oil,1,0.4724,positive,127613,Twitter,"Oil prices getting lower. Great! Like a big Tax Cut for America and the World. Enjoy! $54, was just $82. Thank you to Saudi Arabia, but let’s go lower!",54.63,President — 1st Term (2017–2021),In Office,-7.7064,92293.61,-7.9444,92055.65,-16.5477,83452.32
2018-11-22,2018-11-23,oil_energy,Oil & Energy,oil,2,0.4003,positive,242357,Twitter,"You just can’t win with the Fake News Media. A big story today is that because I have pushed so hard and gotten Gasoline Prices so low, more people are driving and I have caused traffic jams throughout our Great Nation. Sorry everyone!",50.42,President — 1st Term (2017–2021),In Office,0.0,100000.0,2.0428,102042.84,-15.6486,84351.45
2018-11-25,2018-11-26,oil_energy,Oil & Energy,oil,1,0.8716,positive,117789,Twitter,"So great that oil prices are falling (thank you President T). Add that, which is like a big Tax Cut, to our other good Economic news. Inflation down (are you listening Fed)!",51.63,President — 1st Term (2017–2021),In Office,0.0,100000.0,2.5567,102556.65,-10.4784,89521.6
2018-12-05,2018-12-06,oil_energy,Oil & Energy,oil,2,0.6624,positive,160184,Twitter,"Hopefully OPEC will be keeping oil flows as is, not restricted. The World does not want to see, or need, higher oil prices!",51.49,President — 1st Term (2017–2021),In Office,0.0,100000.0,-0.6603,99339.68,-6.8557,93144.3
2019-01-01,2019-01-02,oil_energy,Oil & Energy,oil,2,-0.0549,negative,375768,Twitter,Gas prices are low and expected to go down this year. This would be good!,46.54,President — 1st Term (2017–2021),In Office,0.0,100000.0,6.9618,106961.75,15.578,115578.0
2019-01-14,2019-01-14,oil_energy,Oil & Energy,oil,1,-0.3939,negative,92149,Twitter,"“Gas prices drop across the United States because President Trump has deregulated Energy and we are now producing a great deal more oil than ever before.” @foxandfriends But this is bad news for Russia, why would President Trump do such a thing? Thought he worked for Kremlin?",50.51,President — 1st Term (2017–2021),In Office,3.1677,103167.69,4.0784,104078.4,6.7115,106711.54
2019-01-23,2019-01-23,oil_energy,Oil & Energy,oil,1,-0.5875,negative,130878,Twitter,"Deroy Murdock, National Review: “We are now exporting oil, which is the first time in my lifetime - we are right now the largest producer of oil and gas. This is not good if you’re Vladimir Putin where your chief export is oil. W.H. Agent - Not good for Kremlin.” @TuckerCarlson",52.62,President — 1st Term (2017–2021),In Office,0.9692,100969.21,3.0597,103059.67,8.8179,108817.94
2019-01-30,2019-01-30,oil_energy,Oil & Energy,oil,1,0.2732,positive,104476,Twitter,Maduro willing to negotiate with opposition in Venezuela following U.S. sanctions and the cutting off of oil revenues. Guaido is being targeted by Venezuelan Supreme Court. Massive protest expected today. Americans should not travel to Venezuela until further notice.,54.23,President — 1st Term (2017–2021),In Office,-0.8114,99188.64,-0.4057,99594.32,2.8951,102895.08
2019-02-09,2019-02-11,oil_energy,Oil & Energy,oil,1,0.8436,positive,191282,Twitter,"I think it is very important for the Democrats to press forward with their Green New Deal. It would be great for the so-called “Carbon Footprint” to permanently eliminate all Planes, Cars, Cows, Oil, Gas & the Military - even if no other country would do the same. Brilliant!",52.41,President — 1st Term (2017–2021),In Office,0.0,100000.0,7.0216,107021.56,8.3572,108357.18
2019-02-25,2019-02-25,oil_energy,Oil & Energy,oil,1,0.8122,positive,93180,Twitter,"Oil prices getting too high. OPEC, please relax and take it easy. World cannot take a price hike - fragile!",55.48,President — 1st Term (2017–2021),In Office,0.036,100036.05,2.0007,102000.72,7.0836,107083.63
2019-03-28,2019-03-28,oil_energy,Oil & Energy,oil,1,0.7339,positive,100790,Twitter,"Very important that OPEC increase the flow of Oil. World Markets are fragile, price of Oil getting too high. Thank you!",59.3,President — 1st Term (2017–2021),In Office,1.4165,101416.53,4.7218,104721.75,7.0826,107082.63
2019-04-22,2019-04-22,oil_energy,Oil & Energy,oil,1,-0.9224,negative,87848,Twitter,Saudi Arabia and others in OPEC will more than make up the Oil Flow difference in our now Full Sanctions on Iranian Oil. Iran is being given VERY BAD advice by @JohnKerry and people who helped him lead the U.S. into the very bad Iran Nuclear Deal. Big violation of Logan Act?,65.7,President — 1st Term (2017–2021),In Office,0.9132,100913.24,-3.3486,96651.45,-6.5145,93485.54
2019-04-26,2019-04-26,oil_energy,Oil & Energy,oil,1,-0.2481,negative,87750,Twitter,"Spoke to Saudi Arabia and others about increasing oil flow. All are in agreement. The California tax on gasoline is causing big problems on pricing for that state. Speak to your Governor about reducing. Economic numbers, 3.2% GDP for what is often worst quarter, looking good!",63.3,President — 1st Term (2017–2021),In Office,0.316,100315.96,-2.1485,97851.5,-6.5719,93428.12
2019-06-03,2019-06-03,oil_energy,Oil & Energy,oil,1,0.9018,positive,111400,Twitter,"BIG NEWS! As I promised two weeks ago, the first shipment of LNG has just left the Cameron LNG Export Facility in Louisiana. Not only have thousands of JOBS been created in USA, we’re shipping freedom and opportunity abroad!",53.25,President — 1st Term (2017–2021),In Office,0.4319,100431.92,0.0188,100018.78,7.6808,107680.75
2019-06-24,2019-06-24,oil_energy,Oil & Energy,oil,1,0.2263,positive,150774,Twitter,"China gets 91% of its Oil from the Straight, Japan 62%, & many other countries likewise. So why are we protecting the shipping lanes for other countries (many years) for zero compensation. All of these countries should be protecting their own ships on what has always been....",57.9,President — 1st Term (2017–2021),In Office,-0.1209,99879.1,2.0553,102055.27,-3.4888,96511.23
2019-07-18,2019-07-18,oil_energy,Oil & Energy,oil,1,-0.5267,negative,83162,Twitter,"I want to apprise everyone of an incident in the Strait of Hormuz today, involving #USSBoxer, a U.S. Navy amphibious assault ship. The BOXER took defensive action against an Iranian drone.... pic.twitter.com/Zql6nAUGxF",55.3,President — 1st Term (2017–2021),In Office,0.5967,100596.75,1.302,101301.99,1.6456,101645.57
2019-08-31,2019-09-03,oil_energy,Oil & Energy,oil,1,0.6351,positive,75385,Twitter,"Enjoy the low gas prices over the Labor Day weekend! My energy policies have made America energy independent while keeping prices low, just like a Tax Cut. The Democrats “green” policies will raise your price of gas! https://www.cnbc.com/2019/08/28/gas-prices-are-down-and-more-drivers-will-hit-the-r",53.94,President — 1st Term (2017–2021),In Office,0.0,100000.0,7.2488,107248.79,0.241,100241.01
2019-09-15,2019-09-16,oil_energy,Oil & Energy,oil,4,-0.3201,negative,402933,Twitter,PLENTY OF OIL!,62.9,President — 1st Term (2017–2021),In Office,0.0,100000.0,-6.7727,93227.34,-16.0413,83958.66
