event_date,buy_date,topic,topic_display,instrument,post_count,avg_sentiment,sentiment_label,total_engagement,platform,headline_text,buy_price,presidency_era,in_office,return_1d_pct,value_1d,return_1w_pct,value_1w,return_1m_pct,value_1m
2023-12-30,2024-01-02,oil_energy,Oil & Energy,oil,1,-0.9706,negative,12602,Truth Social,"Remember I said, from the beginning, “don’t go into Iraq, but if you do, keep the OIL.” What a BAD decision by Bush. All of those lives, gone, and $Trillions spent, and now Iran controls Iraq, and has the Oil. “Stupid!!!” Iraq used to be the strong counter to Iran, but we obliterated them, and now I",70.38,Not President (2021–2024),Not In Office,0.0,100000.0,0.5541,100554.13,9.0935,109093.49
2024-02-27,2024-02-27,oil_energy,Oil & Energy,oil,1,0.9431,positive,14369,Truth Social,"Stormy Bradley is running for Texas State House District 72 against RINO Drew Darby, who voted to Impeach Texas’ Great Attorney General, Ken Paxton. As a State Representative, Stormy will fight to Secure the Border, Support the American Oil Industry, Champion School Choice, and Protect and Defend ou",78.87,Not President (2021–2024),Not In Office,-0.4184,99581.59,-0.9129,99087.11,5.452,105452.01
2024-03-14,2024-03-14,oil_energy,Oil & Energy,oil,1,-0.3182,negative,10941,Truth Social,‘Blood Money’: The Biden Family Bagged $5M from Business Partner of ‘White Wolf’ Chinese Criminal Gang Leader Who Helped Create the Fentanyl Pipeline Decimating America:\n https://www. breitbart.com/politics/2024/02 /27/blood-money-how-the-biden-family-bagged-5m-from-business-partner-of-white-wolf-c,81.26,Not President (2021–2024),Not In Office,-0.2707,99729.26,-0.2338,99766.18,5.1071,105107.06
2024-03-22,2024-03-22,oil_energy,Oil & Energy,oil,1,0.0,neutral,20060,Truth Social,So there it goes again. The price of gasoline is skyrocketing…,80.63,Not President (2021–2024),Not In Office,1.6371,101637.11,3.8199,103819.92,2.7533,102753.32
2024-04-04,2024-04-04,oil_energy,Oil & Energy,oil,1,0.0,neutral,13639,Truth Social,https://www. bigdatapoll.com/blog/rust-belt -poll-keystone-battleground-for-april-2024/,86.59,Not President (2021–2024),Not In Office,0.3696,100369.56,-1.8131,98186.86,-9.366,90634.02
2024-04-07,2024-04-08,oil_energy,Oil & Energy,oil,1,0.8573,positive,21938,Truth Social,"After selling his highly successful Oil and Gas Business, Tony Wied has decided to run for Congress in Wisconsin’s 8th Congressional District. Tony is running against RINO Roger Roth, who is a “clone” of Paul Ryan, and no friend to MAGA - He should drop out of the Race NOW. As your next Congressman,",86.43,Not President (2021–2024),Not In Office,0.0,100000.0,-1.1801,98819.85,-9.3139,90686.1
2024-04-13,2024-04-15,oil_energy,Oil & Energy,oil,1,0.7563,positive,7018,Truth Social,"Congressman Mike Kelly is a terrific Representative of the incredible people of Pennsylvania’s 16th Congressional District! Mike is working hard to Secure the Border, Stop Illegal Immigration and Migrant Crime, Champion American Energy and Natural Gas, Grow the Economy, Cut Taxes, Eliminate Burdenso",85.41,Not President (2021–2024),Not In Office,0.0,100000.0,-2.9973,97002.69,-7.3645,92635.52
2024-04-22,2024-04-22,oil_energy,Oil & Energy,oil,1,0.8573,positive,14183,Truth Social,"After selling his highly successful Oil and Gas Business, Tony Wied has decided to run for Congress in Wisconsin’s 8th Congressional District. Tony is running against RINO Roger Roth, who is a “clone” of Paul Ryan, and no friend to MAGA - He should drop out of the Race NOW. As your next Congressman,",82.85,Not President (2021–2024),Not In Office,0.6156,100615.57,-0.2655,99734.46,-6.373,93627.04
2024-04-25,2024-04-25,oil_energy,Oil & Energy,oil,1,-0.0754,negative,18280,Truth Social,"Steamfitters Local 638 manager: ""It was great to see the president come and engage with the blue collar worker of New York City...I put out a poll in my union, President Trump is leading Joe Biden 3 to 1...we are very tired of...inflation, gas prices, illegal immigration...""",83.57,Not President (2021–2024),Not In Office,0.335,100335.05,-5.5283,94471.7,-4.4753,95524.71
2024-05-17,2024-05-17,oil_energy,Oil & Energy,oil,1,0.6514,positive,16800,Truth Social,"I have accepted a fourth Presidential Debate against Crooked Joe Biden, this time with NBC & Telemundo. It is important as Republicans that we WIN with our Great Hispanic Community, who Biden has devastated with Crippling Inflation, High Gas Prices, Crime in our Streets, and Border Chaos. This Fourt",80.06,Not President (2021–2024),Not In Office,-0.3248,99675.24,-2.9228,97077.19,0.3372,100337.25
2024-05-20,2024-05-20,oil_energy,Oil & Energy,oil,1,0.5551,positive,7849,Truth Social,"Congressman Barry Loudermilk is a true American Patriot and a fantastic Representative for the hard-working people of Georgia’s 11th Congressional District. A U.S. Air Force Veteran, Barry is working tirelessly to grow the Economy, lower Gas Prices, support our Military/Vets, secure our Border, defe",79.8,Not President (2021–2024),Not In Office,-0.6767,99323.31,0.0376,100037.59,2.9699,102969.92
2024-05-21,2024-05-21,oil_energy,Oil & Energy,oil,1,-0.7667,negative,15002,Truth Social,DISGUSTING! \n“Biden releasing 1 million barrels of gasoline from Northeast reserve in bid to lower prices at pump” https:// apnews.com/article/gas-prices- biden-northeast-reserve-6fa669ef3c963d212852513e4b312060,79.26,Not President (2021–2024),Not In Office,-2.1322,97867.78,0.7192,100719.15,3.6715,103671.46
2024-05-26,2024-05-28,oil_energy,Oil & Energy,oil,2,0.9477,positive,15081,Truth Social,"Steve Scalise has done a tremendous job representing Louisiana’s 1st Congressional District. \nAs the Majority Leader, Steve is a tireless advocate forour America First Agenda. He works to Protect American Oil and Gas, Secure our Borders, Grow the Economy, Create more Jobs, Support our Veterans and ",79.83,Not President (2021–2024),Not In Office,0.0,100000.0,-7.0274,92972.57,1.2527,101252.66
2024-05-30,2024-05-30,oil_energy,Oil & Energy,oil,1,0.9759,positive,11041,Truth Social,"Julie Fedorchak is an incredible Candidate who will do a fantastic job representing the Great People of North Dakota in Congress. An America First Conservative, Julie will work hard to grow the Economy, stop Inflation, cut Taxes and Regulations, secure the Border, support our wonderful Military/Vets",77.91,Not President (2021–2024),Not In Office,-1.1808,98819.15,-3.0291,96970.86,7.0209,107020.92
2024-06-03,2024-06-03,oil_energy,Oil & Energy,oil,1,0.9467,positive,8806,Truth Social,"Yvette Herrell is running to once again represent the great people of New Mexico’s 2nd Congressional District. A successful entrepreneur, Yvette knows how to Expand our Economy, Fight Inflation, and Create High-Paying Jobs. She will work hard to Lower Gas Prices, Support our Vets, Strengthen our Mil",74.22,Not President (2021–2024),Not In Office,-1.3069,98693.07,4.7427,104742.66,13.0154,113015.36
2024-06-10,2024-06-10,oil_energy,Oil & Energy,oil,1,0.9767,positive,11224,Truth Social,"Julie Fedorchak is an incredible Candidate who will do a fantastic job representing the Great People of North Dakota in Congress. An America First Conservative, Julie will work hard to grow the Economy, stop Inflation, cut Taxes and Regulations, secure the Border, support our wonderful Military/Vets",77.74,Not President (2021–2024),Not In Office,0.2058,100205.81,3.3316,103331.62,5.6084,105608.44
2024-07-08,2024-07-08,oil_energy,Oil & Energy,oil,1,0.7783,positive,10654,Truth Social,….“Federal Campaign Finance laws are an incumbent protection measure that makes it too hard for challengers to knock off incumbents who have much higher name id and who have franking privileges which allow them unlimited free correspondence with their constituents through the mail. That it is not to,82.33,Not President (2021–2024),Not In Office,-1.1175,98882.55,-0.5101,99489.86,-8.6238,91376.17
2024-07-29,2024-07-29,oil_energy,Oil & Energy,oil,1,0.6307,positive,26467,Truth Social,OPEC NATIONS ARE GOING ALL OUT TO DRIVE DOWN OIL PRICES IN THE HOPE THAT CRAZY KAMALA HARRIS WILL WIN. THEN THEY WILL REALLY REAP THE REWARDS! SHE WILL BE A DISASTER FOR THE USA!,75.81,Not President (2021–2024),Not In Office,-1.4246,98575.39,-3.7858,96214.22,-1.7016,98298.38
2024-07-31,2024-07-31,oil_energy,Oil & Energy,oil,2,0.3215,positive,60175,Truth Social,Crazy Kamala Harris should never have taken the Trump Oil Sanctions off Maduro. She made one of the ALL TIME WORST DEALS! Crazy Kamala helped lead the charge to release Maduro’s top Money Launderer and his two convicted Drug Dealer Nephews in return for an obviously fake promise of Free and Fair Ele,77.91,Not President (2021–2024),Not In Office,-2.0537,97946.35,-3.4399,96560.13,-5.5962,94403.8
2024-08-08,2024-08-08,oil_energy,Oil & Energy,oil,1,-0.9939,negative,18402,Truth Social,"Kamala refuses to do interviews because her team realizes she is unable to answer questions, much like Biden was not able to answer questions, but for different reasons. He is just plain “shot,” and she is just plain “Incompetent.” Her policies of Open Borders, No Fracking or Drilling for Oil in any",76.19,Not President (2021–2024),Not In Office,0.8531,100853.13,2.5856,102585.64,-9.8176,90182.44
2024-08-13,2024-08-13,oil_energy,Oil & Energy,oil,1,0.8573,positive,17633,Truth Social,"After selling his highly successful Oil and Gas Business, Tony Wied decided to run for Congress in Wisconsin’s 8th Congressional District. Tony is running against RINO Roger Roth, who is a “clone” of Paul Ryan, and no friend to MAGA - He should drop out of the Race NOW. As your next Congressman, Ton",78.35,Not President (2021–2024),Not In Office,-1.7486,98251.44,-5.501,94499.04,-11.9719,88028.08
2024-08-20,2024-08-20,oil_energy,Oil & Energy,oil,1,-0.9658,negative,20069,Truth Social,"Kamala Harris supports the Environmental Extremists’ “NET-ZERO” Energy Policy - A Radical Left Agenda to abolish Coal, Oil, and Natural Gas, and plunge MILLIONS into Poverty. Net Zero Lunatics are currently destroying the Economies of many other Countries, including the U.K. Their Radical, Self-Dest",74.04,Not President (2021–2024),Not In Office,-2.8498,97150.19,2.0124,102012.43,-2.8228,97177.2
2024-08-25,2024-08-26,oil_energy,Oil & Energy,oil,1,0.0,neutral,19416,Truth Social,“KAMALA WILL SHUT DOWN FRACKING IN PENNSYLVANIA THE DAY AFTER THE ELECTION” https:// thehill.com/policy/energy-envi ronment/4639483-joe-biden-pennsylvania-lng-liquefied-natural-gas-lng-bob-casey-david-mccormick/,77.42,Not President (2021–2024),Not In Office,0.0,100000.0,-9.1449,90855.08,-7.5691,92430.9
2024-08-29,2024-08-29,oil_energy,Oil & Energy,oil,1,-0.6935,negative,20542,Truth Social,"I just saw Comrade Kamala Harris’ answer to a very weakly-phrased question, a question that was put in more as a matter of defense than curiosity, but her answer rambled incoherently, and declared her “values haven’t changed.” On that I agree, her values haven’t changed - The Border is going to rema",75.91,Not President (2021–2024),Not In Office,-3.1089,96891.06,-8.9053,91094.72,-10.1963,89803.71
2024-09-02,2024-09-03,oil_energy,Oil & Energy,oil,2,-0.071,negative,206568,Truth Social,"Happy Labor Day to all of our American Workers who represent the Shining Example of Hard Work and Ingenuity. Under Comrade Kamala Harris, all Americans are suffering during this Holiday weekend — High Gas Prices, Transportation Costs are up, and Grocery Prices are through the… https://t.co/a2FqhEDI5",70.34,Not President (2021–2024),Not In Office,0.0,100000.0,-2.3173,97682.68,-0.3412,99658.8
2024-09-03,2024-09-03,oil_energy,Oil & Energy,oil,1,0.4898,positive,21438,Truth Social,"Maduro’s plane has just been seized by the U.S. That’s OK, he can now go out and get a much bigger and better one with all the money we pay to Venezuela for oil that we don’t need. We have more LIQUID GOLD than any other Nation. HOW STUPID ARE OUR “LEADERS?” WE ARE A LAUGHING STOCK ALL OVER THE WORL",70.34,Not President (2021–2024),Not In Office,-1.6207,98379.3,-6.5254,93474.55,4.791,104791.02
2024-09-09,2024-09-09,oil_energy,Oil & Energy,oil,1,0.0,neutral,8822,Truth Social,https:// thenationalpulse.com/2024/08/2 9/biden-harris-govts-backdoor-move-to-ban-all-oil-drilling-in-the-gulf-of-mexico/,68.71,Not President (2021–2024),Not In Office,-4.308,95692.04,2.0084,102008.44,6.5929,106592.93
2024-09-19,2024-09-19,oil_energy,Oil & Energy,oil,1,0.0,neutral,14261,Truth Social,"Michigan Voter: ""I'm going to vote for Donald Trump this year. I am typically a Democrat...Three and a half years ago, I made more money, I paid less taxes, gas prices were cheaper. Now, everything has tripled, including grocery prices.""",71.95,Not President (2021–2024),Not In Office,-0.0417,99958.3,-5.9486,94051.42,-1.9319,98068.1
2024-09-21,2024-09-23,oil_energy,Oil & Energy,oil,1,0.364,positive,12492,Truth Social,"VIRGINIA: Early Voting HAS BEGUN! We need ALL VIRGINIA PATRIOTS TO GET OUT AND VOTE, so that our WIN is “TOO BIG TO RIG.” In order to take our Country back from the Radical Left Thugs and Lunatics that are destroying it, including our Border, the Migrant Invasion, Economy, Inflation, Rising Gas Pric",70.37,Not President (2021–2024),Not In Office,0.0,100000.0,-3.1263,96873.67,0.27,100270.0
2024-10-01,2024-10-01,oil_energy,Oil & Energy,oil,1,0.0,neutral,20155,Truth Social,"OIL IS UP, THE WORLD IS CRASHING - WE NEED TRUMP!",69.83,Not President (2021–2024),Not In Office,0.3867,100386.65,5.3559,105355.86,-0.8163,99183.73
2024-10-11,2024-10-11,oil_energy,Oil & Energy,oil,1,0.3818,positive,11246,Truth Social,“Trump vows to protect America’s electric grid during Keystone State BLITZ” https:// writerevolutionnews.com/2024/1 0/09/trump-vows-to-protect-americas-electric-grid-during-keystone-state-blitz/,75.56,Not President (2021–2024),Not In Office,-2.2896,97710.43,-8.3907,91609.32,-9.9524,90047.64
2024-10-12,2024-10-14,oil_energy,Oil & Energy,oil,2,0.0396,neutral,29910,Truth Social,"Kamala Harris vowed to Abolish ICE. \nShe wants to BAN FRACKING. \nShe imposed a Natural Gas Export Ban. \nEnergy prices are already up 50% in Nevada under Kamala. \nShe LOST more than 325,000 migrant children. \nSHE DOES NOT DESERVE FOUR MORE YEARS!",73.83,Not President (2021–2024),Not In Office,0.0,100000.0,-4.4291,95570.91,-7.8423,92157.66
2024-10-22,2024-10-22,oil_energy,Oil & Energy,oil,1,-0.3664,negative,20603,Truth Social,"U.S. Oil and Gas Association calls out Harris on Flip Flopping. She WILL BAN FRACKING, PENNSYLVANIA! Fox & Friends",72.09,Not President (2021–2024),Not In Office,-1.831,98168.96,-6.7693,93230.68,-2.7604,97239.56
2024-12-05,2024-12-05,oil_energy,Oil & Energy,oil,1,0.0,neutral,20,Truth Social,https://www. washingtontimes.com/news/2024/ nov/26/drill-baby-drill-50-oil-curb-inflation/,68.3,Not President (2021–2024),Not In Office,-1.6105,98389.46,2.5183,102518.3,7.7013,107701.32
2024-12-20,2024-12-20,oil_energy,Oil & Energy,oil,1,-0.2661,negative,36719,Truth Social,"I told the European Union that they must make up their tremendous deficit with the United States by the large scale purchase of our oil and gas. Otherwise, it is TARIFFS all the way!!!",69.46,Not President (2021–2024),Not In Office,-0.3167,99683.27,1.6412,101641.23,9.2571,109257.13
2025-02-25,2025-02-25,oil_energy,Oil & Energy,oil,1,0.5222,positive,0,Truth Social,"Our Country’s doing really well, and today, I was just thinking, that the company building the Keystone XL Pipeline that was viciously jettisoned by the incompetent Biden Administration should come back to America, and get it built — NOW! I know they were treated very badly by Sleepy Joe Biden, but ",68.93,President — 2nd Term (2025+),In Office,-0.4497,99550.27,-0.972,99028.0,1.4362,101436.24
2025-02-26,2025-02-26,oil_energy,Oil & Energy,oil,1,0.254,positive,178,Truth Social,"We are hereby reversing the concessions that Crooked Joe Biden gave to Nicolás Maduro, of Venezuela, on the oil transaction agreement, dated November 26, 2022, and also having to do with Electoral conditions within Venezuela, which have not been met by the Maduro regime. Additionally, the regime has",68.62,President — 2nd Term (2025+),In Office,2.5211,102521.13,-3.3664,96633.63,1.0784,101078.4
2025-03-01,2025-03-03,oil_energy,Oil & Energy,oil,2,0.0,neutral,50,Truth Social,https://www. telegraph.co.uk/business/2025/ 01/03/trump-attacks-labours-decision-to-abandon-north-sea-oil/,68.37,President — 2nd Term (2025+),In Office,0.0,100000.0,-3.4226,96577.45,4.5488,104548.78
2025-03-03,2025-03-03,oil_energy,Oil & Energy,oil,1,0.0,neutral,334,Truth Social,Europe has spent more money buying Russian Oil and Gas than they have spent on defending Ukraine —BY FAR!,68.37,President — 2nd Term (2025+),In Office,-0.1609,99839.11,-3.4226,96577.45,4.8852,104885.18
2025-03-10,2025-03-10,oil_energy,Oil & Energy,oil,4,0.0,neutral,783,Truth Social,https://www. foxnews.com/us/alaska-leaders- cheer-trump-oil-gas-drilling-executive-order,66.03,President — 2nd Term (2025+),In Office,0.3332,100333.18,2.3474,102347.42,-5.5732,94426.78
2025-03-11,2025-03-11,oil_energy,Oil & Energy,oil,1,0.7836,positive,352,Truth Social,"The price of eggs have come down, interest rates have come down, gasoline prices have come down—It's all coming down! We're doing it the right way, and I have tremendous confidence in this Country and in the people of this Country…",66.25,President — 2nd Term (2025+),In Office,2.1585,102158.49,0.9811,100981.13,-9.3283,90671.7
2025-03-13,2025-03-13,oil_energy,Oil & Energy,oil,1,0.8427,positive,126,Truth Social,"The Globalist Wall Street Journal has no idea what they are doing or saying. They are owned by the polluted thinking of the European Union, which was formed for the primary purpose of “screwing” the United States of America. Their (WSJ!) thinking is antiquated and weak, and very bad for the USA. But",66.55,President — 2nd Term (2025+),In Office,0.9467,100946.66,2.5695,102569.5,-7.5432,92456.8
2025-03-21,2025-03-21,oil_energy,Oil & Energy,oil,1,0.8743,positive,184,Truth Social,"Egg prices are WAY DOWN from the Biden inspired prices if just a few weeks ago. “Groceries” and Gasoline are down, also. Now, if the Fed would do the right thing and lower interest rates, that would be great!!!",68.28,President — 2nd Term (2025+),In Office,1.2156,101215.58,1.5817,101581.72,-7.6157,92384.3
2025-03-24,2025-03-24,oil_energy,Oil & Energy,oil,1,-0.6081,negative,28,Truth Social,"President Donald J. Trump announced today that the United States of America will be putting what is known as a Secondary Tariff on the Country of Venezuela, for numerous reasons, including the fact that Venezuela has purposefully and deceitfully sent to the United States, undercover, tens of thousan",69.11,President — 2nd Term (2025+),In Office,-0.1592,99840.83,3.4293,103429.32,-9.8973,90102.73
2025-03-26,2025-03-26,oil_energy,Oil & Energy,oil,1,0.6486,positive,110,Truth Social,"“U.S. natural gas production is at an all-time high today...I was down a few weeks ago at a brand-new LNG export terminal in Louisiana coming online—We've approved four more within the first 100 days of the Trump administration...""",69.65,President — 2nd Term (2025+),In Office,0.3877,100387.65,2.9576,102957.65,-9.519,90480.98
2025-04-01,2025-04-01,oil_energy,Oil & Energy,oil,2,0.0,neutral,206,Truth Social,"“Trump tariff on Venezuelan oil buyers shakes global market, major refiners pull back” https://www. miamiherald.com/news/nation-wo rld/world/americas/venezuela/article302854669.html#storylink=cpy",71.2,President — 2nd Term (2025+),In Office,0.7163,100716.29,-16.3202,83679.78,-16.7978,83202.25
2025-04-07,2025-04-07,oil_energy,Oil & Energy,oil,4,-0.4082,negative,33026,Truth Social,"Oil prices are down, interest rates are down (the slow moving Fed should cut rates!), food prices are down, there is NO INFLATION, and the long time abused USA is bringing in Billions of Dollars a week from the abusing countries on Tariffs that are already in place. This is",60.7,President — 2nd Term (2025+),In Office,-1.8451,98154.86,1.3674,101367.38,-4.3328,95667.22
2025-04-08,2025-04-08,oil_energy,Oil & Energy,oil,1,0.9867,positive,2,Truth Social,"I just had a great call with the Acting President of South Korea. We talked about their tremendous and unsustainable Surplus, Tariffs, Shipbuilding, large scale purchase of U.S. LNG, their joint venture in an Alaska Pipeline, and payment for the big time Military Protection we provide to South Korea",59.58,President — 2nd Term (2025+),In Office,4.6492,104649.21,2.9372,102937.23,0.5539,100553.88
2025-04-16,2025-04-16,oil_energy,Oil & Energy,oil,1,0.807,positive,39218,Truth Social,"The United States is taking in RECORD NUMBERS in Tariffs, with the cost of almost all products going down, including gasoline, groceries, and just about everything else. Likewise, INFLATION is down. Promises Made, Promises Kept!",62.47,President — 2nd Term (2025+),In Office,3.5377,103537.7,-0.3202,99679.85,0.032,100032.02
2025-04-17,2025-04-17,oil_energy,Oil & Energy,oil,1,0.6571,positive,38345,Truth Social,"The ECB is expected to cut interest rates for the 7th time, and yet, “Too Late” Jerome Powell of the Fed, who is always TOO LATE AND WRONG, yesterday issued a report which was another, and typical, complete “mess!” Oil prices are down, groceries (even eggs!) are down, and the USA is getting RICH ON ",64.68,President — 2nd Term (2025+),In Office,-2.4737,97526.28,-2.9221,97077.92,-3.0767,96923.31
2025-04-25,2025-04-25,oil_energy,Oil & Energy,oil,1,0.0,neutral,54,Truth Social,https:// nypost.com/2025/04/24/us-news/ trump-admin-will-increase-oil-production-in-gulf-of-america-by-100k-barrels-a-day-under-new-drilling-policy/,63.02,President — 2nd Term (2025+),In Office,-1.5392,98460.81,-7.5056,92494.45,-3.3799,96620.12
2025-05-01,2025-05-01,oil_energy,Oil & Energy,oil,2,0.825,positive,85,Truth Social,"ALERT: All purchases of Iranian Oil, or Petrochemical products, must stop, NOW! Any Country or person who buys ANY AMOUNT of OIL or PETROCHEMICALS from Iran will be subject to, immediately, Secondary Sanctions. They will not be allowed to do business with the United States of America in any way, sha",59.24,President — 2nd Term (2025+),In Office,-1.6036,98396.35,1.131,101130.99,5.5368,105536.8
2025-05-02,2025-05-02,oil_energy,Oil & Energy,oil,1,-0.3272,negative,8,Truth Social,"Gasoline just broke $1.98 a Gallon, lowest in years, groceries (and eggs!) down, energy down, mortgage rates down, employment strong, and much more good news, as Billions of Dollars pour in from Tariffs. Just like I said, and we’re only in a TRANSITION STAGE, just getting started!!! Consumers have b",58.29,President — 2nd Term (2025+),In Office,-1.99,98009.95,4.6835,104683.48,7.2568,107256.82
2025-05-06,2025-05-06,oil_energy,Oil & Energy,oil,1,0.4357,positive,13,Truth Social,"Charles Payne: ""I was in Louisiana this year—you have all this natural gas and guess what? You've got these large companies that are coming to Louisiana to build data centers... that's been the message from the market the last two weeks... the next page of American Exceptionalism.""",59.09,President — 2nd Term (2025+),In Office,-1.7262,98273.82,7.7509,107750.89,7.2432,107243.19
2025-05-08,2025-05-08,oil_energy,Oil & Energy,oil,1,0.4297,positive,85,Truth Social,"“Too Late” Jerome Powell is a FOOL, who doesn’t have a clue. Other than that, I like him very much! Oil and Energy way down, almost all costs (groceries and “eggs”) down, virtually NO INFLATION, Tariff Money Pouring Into the U.S. — THE EXACT OPPOSITE OF “TOO LATE!” ENJOY!",59.91,President — 2nd Term (2025+),In Office,1.8528,101852.78,2.8543,102854.28,8.9801,108980.14
2025-05-12,2025-05-12,oil_energy,Oil & Energy,oil,2,0.0589,positive,80,Truth Social,"Jack Ciattarelli is a terrific America First Candidate running to be the next Governor of a State that I love, NEW JERSEY!\n \nJack, who after getting to know and understand MAGA, has gone ALL IN, and is now 100% (PLUS!). He is strongly supported by the most Highly Respected Leaders in New Jersey an",61.95,President — 2nd Term (2025+),In Office,2.7764,102776.43,1.1945,101194.51,10.0081,110008.07
2025-05-13,2025-05-13,oil_energy,Oil & Energy,oil,1,0.6207,positive,250,Truth Social,"No Inflation, and Prices of Gasoline, Energy, Groceries, and practically everything else, are DOWN!!! THE FED must lower the RATE, like Europe and China have done. What is wrong with Too Late Powell? Not fair to America, which is ready to blossom? Just let it all happen, it will be a beautiful thing",63.67,President — 2nd Term (2025+),In Office,-0.8167,99183.29,-1.7434,98256.64,6.8635,106863.51
2025-05-23,2025-05-23,oil_energy,Oil & Energy,oil,1,0.8553,positive,70,Truth Social,"Our negotiated deal with the United Kingdom is working out well for all. I strongly recommend to them, however, that in order to get their Energy Costs down, they stop with the costly and unsightly windmills, and incentivize modernized drilling in the North Sea, where large amounts of oil lay waitin",61.53,President — 2nd Term (2025+),In Office,-1.0401,98959.86,-1.2027,98797.33,11.3441,111344.06
2025-05-25,2025-05-27,oil_energy,Oil & Energy,oil,3,0.9798,positive,139,Truth Social,"Congressman Andrew Garbarino is a Fierce Advocate for Long Island, and the Great People of New York’s 2nd Congressional District!\n \nAndrew has an incredible Record of Success, and strong support from his Community. In Congress, he is fighting tirelessly to Grow our Economy, Cut Taxes and Regulatio",60.89,President — 2nd Term (2025+),In Office,0.0,100000.0,2.677,102676.96,5.7152,105715.22
