event_date,buy_date,topic,topic_display,instrument,post_count,avg_sentiment,sentiment_label,total_engagement,platform,headline_text,buy_price,presidency_era,in_office,return_1d_pct,value_1d,return_1w_pct,value_1w,return_1m_pct,value_1m
2017-11-17,2017-11-17,sp500,S&P 500,sp500,1,0.8203,positive,75165,Twitter,"Great numbers on Stocks and the Economy. If we get Tax Cuts and Reform, we'll really see some great results!",2578.8501,President — 1st Term (2017–2021),In Office,0.1276,100127.57,0.914,100913.97,4.3163,104316.26
2017-11-19,2017-11-20,tariffs_china,Tariffs & China,sp500,2,-0.2347,negative,434731,Twitter,"Now that the three basketball players are out of China and saved from years in jail, LaVar Ball, the father of LiAngelo, is unaccepting of what I did for his son and that shoplifting is no big deal. I should have left them in jail!",2582.1399,President — 1st Term (2017–2021),In Office,0.0,100000.0,0.7467,100746.67,3.8468,103846.81
2017-11-22,2017-11-22,tariffs_china,Tariffs & China,sp500,2,-0.7555,negative,299118,Twitter,"...LaVar, you could have spent the next 5 to 10 years during Thanksgiving with your son in China, but no NBA contract to support you. But remember LaVar, shoplifting is NOT a little thing. It’s a really big deal, especially in China. Ungrateful fool!",2597.0801,President — 1st Term (2017–2021),In Office,0.2056,100205.61,1.1163,101116.25,3.3214,103321.42
2017-11-23,2017-11-24,sp500,S&P 500,sp500,1,0.9564,positive,212881,Twitter,"HAPPY THANKSGIVING, your Country is starting to do really well. Jobs coming back, highest Stock Market EVER, Military getting really strong, we will build the WALL, V.A. taking care of our Vets, great Supreme Court Justice, RECORD CUT IN REGS, lowest unemployment in 17 years....!",2602.4199,President — 1st Term (2017–2021),In Office,0.0,100000.0,1.7353,101735.32,3.0003,103000.29
2017-11-24,2017-11-24,israel_mideast,Israel & Middle East,sp500,1,-0.4389,negative,70698,Twitter,"Will be speaking to President Recep Tayyip Erdogan of Turkey this morning about bringing peace to the mess that I inherited in the Middle East. I will get it all done, but what a mistake, in lives and dollars (6 trillion), to be there in the first place!",2602.4199,President — 1st Term (2017–2021),In Office,-0.0384,99961.57,1.5293,101529.35,3.0003,103000.29
2017-11-25,2017-11-27,sp500,S&P 500,sp500,1,-0.6588,negative,45966,Twitter,"Check out the recent Editorial in the Wall Street Journal @WSJ about what a complete disaster the @CFPB has been under its leader from previous Administration, who just quit!",2601.4199,President — 1st Term (2017–2021),In Office,0.0,100000.0,1.4615,101461.51,3.0399,103039.88
2017-11-28,2017-11-28,sp500,S&P 500,sp500,2,0.3145,positive,128325,Twitter,New home sales reach a 10 year high. Stock Market has more record gains. Hopefully Republican Senators will give us the much needed Tax Cuts to keep it all going! Democrats want big Tax Increases.,2627.04,President — 1st Term (2017–2021),In Office,-0.0369,99963.08,0.0963,100096.31,2.303,102302.97
2017-11-29,2017-11-29,sp500,S&P 500,sp500,2,0.356,positive,135378,Twitter,Looks like another great day for the Stock Market. Consumer Confidence is at Record High. I guess somebody likes me (my policies)!,2626.0701,President — 1st Term (2017–2021),In Office,0.8191,100819.09,0.1219,100121.85,1.8103,101810.31
2017-11-30,2017-11-30,sp500,S&P 500,sp500,2,0.7836,positive,190165,Twitter,"The Dow just broke 24,000 for the first time (another all-time Record). If the Dems had won the Presidential Election, the Market would be down 50% from these levels and Consumer Confidence, which is also at an all-time high, would be “low and glum!”",2647.5801,President — 1st Term (2017–2021),In Office,-0.2025,99797.55,-0.4004,99599.63,1.8217,101821.66
2017-12-03,2017-12-04,sp500,S&P 500,sp500,1,-0.9553,negative,132586,Twitter,"People who lost money when the Stock Market went down 350 points based on the False and Dishonest reporting of Brian Ross of @ABC News (he has been suspended), should consider hiring a lawyer and suing ABC for the damages this bad reporting has caused - many millions of dollars!",2639.4399,President — 1st Term (2017–2021),In Office,0.0,100000.0,0.7786,100778.58,2.1357,102135.69
2017-12-04,2017-12-04,sp500,S&P 500,sp500,2,0.0998,positive,189025,Twitter,"Putting Pelosi/Schumer Liberal Puppet Jones into office in Alabama would hurt our great Republican Agenda of low on taxes, tough on crime, strong on military and borders...& so much more. Look at your 401-k’s since Election. Highest Stock Market EVER! Jobs are roaring back!",2639.4399,President — 1st Term (2017–2021),In Office,-0.3739,99626.06,0.7786,100778.58,2.7892,102789.24
2017-12-06,2017-12-06,israel_mideast,Israel & Middle East,sp500,1,0.34,positive,146991,Twitter,I have determined that it is time to officially recognize Jerusalem as the capital of Israel. I am also directing the State Department to begin preparation to move the American Embassy from Tel Aviv to Jerusalem... pic.twitter.com/YwgWmT0O8m,2629.27,President — 1st Term (2017–2021),In Office,0.2932,100293.24,1.2772,101277.16,4.3312,104331.24
2017-12-10,2017-12-11,sp500,S&P 500,sp500,1,-0.4763,negative,131376,Twitter,"Things are going really well for our economy, a subject the Fake News spends as little time as possible discussing! Stock Market hit another RECORD HIGH, unemployment is now at a 17 year low and companies are coming back into the USA. Really good news, and much more to come!",2659.99,President — 1st Term (2017–2021),In Office,0.0,100000.0,1.1342,101134.21,3.4323,103432.34
2017-12-12,2017-12-12,sp500,S&P 500,sp500,1,0.6588,positive,94177,Twitter,"Consumer Confidence is at an All-Time High, along with a Record High Stock Market. Unemployment is at a 17 year low. MAKE AMERICA GREAT AGAIN! Working to pass MASSIVE TAX CUTS (looking good).",2664.1101,President — 1st Term (2017–2021),In Office,-0.0473,99952.7,0.6516,100651.62,3.8831,103883.1
2017-12-14,2017-12-14,sp500,S&P 500,sp500,2,0.3826,positive,133070,Twitter,"Republican Tax Cuts are looking very good. All are working hard. In the meantime, the Stock Market hit another record high!",2652.01,President — 1st Term (2017–2021),In Office,0.8974,100897.44,1.2278,101227.75,4.6912,104691.16
2017-12-16,2017-12-18,sp500,S&P 500,sp500,1,0.0,neutral,59605,Twitter,"DOW, S&P 500 and NASDAQ close at record highs! #MAGA pic.twitter.com/hvqwnqSGuG",2690.1599,President — 1st Term (2017–2021),In Office,0.0,100000.0,-0.3591,99640.92,3.2065,103206.5
2017-12-18,2017-12-18,israel_mideast,Israel & Middle East,sp500,1,-0.2225,negative,109620,Twitter,"The train accident that just occurred in DuPont, WA shows more than ever why our soon to be submitted infrastructure plan must be approved quickly. Seven trillion dollars spent in the Middle East while our roads, bridges, tunnels, railways (and more) crumble! Not for long!",2690.1599,President — 1st Term (2017–2021),In Office,-0.323,99676.97,-0.3591,99640.92,4.1782,104178.2
2017-12-19,2017-12-19,sp500,S&P 500,sp500,1,0.8675,positive,71223,Twitter,"Stocks and the economy have a long way to go after the Tax Cut Bill is totally understood and appreciated in scope and size. Immediate expensing will have a big impact. Biggest Tax Cuts and Reform EVER passed. Enjoy, and create many beautiful JOBS!",2681.47,President — 1st Term (2017–2021),In Office,-0.0828,99917.21,-0.0362,99963.83,4.3469,104346.87
2017-12-22,2017-12-22,israel_mideast,Israel & Middle East,sp500,1,0.6239,positive,126564,Twitter,"At some point, and for the good of the country, I predict we will start working with the Democrats in a Bipartisan fashion. Infrastructure would be a perfect place to start. After having foolishly spent $7 trillion in the Middle East, it is time to start rebuilding our country!",2683.3401,President — 1st Term (2017–2021),In Office,-0.1058,99894.16,-0.3626,99637.39,5.5763,105576.26
2017-12-23,2017-12-26,sp500,S&P 500,sp500,1,-0.7922,negative,104896,Twitter,"The Stock Market is setting record after record and unemployment is at a 17 year low. So many things accomplished by the Trump Administration, perhaps more than any other President in first year. Sadly, will never be reported correctly by the Fake News Media!",2680.5,President — 1st Term (2017–2021),In Office,0.0,100000.0,0.5712,100571.17,5.6881,105688.12
2017-12-26,2017-12-26,sp500,S&P 500,sp500,1,0.9218,positive,133626,Twitter,"All signs are that business is looking really good for next year, only to be helped further by our Tax Cut Bill. Will be a great year for Companies and JOBS! Stock Market is poised for another year of SUCCESS!",2680.5,President — 1st Term (2017–2021),In Office,0.0791,100079.09,0.5712,100571.17,5.9224,105922.4
2017-12-28,2017-12-28,tariffs_china,Tariffs & China,sp500,1,-0.7726,negative,133518,Twitter,Caught RED HANDED - very disappointed that China is allowing oil to go into North Korea. There will never be a friendly solution to the North Korea problem if this continues to happen!,2687.54,President — 1st Term (2017–2021),In Office,-0.5183,99481.69,1.3563,101356.26,6.1763,106176.28
2017-12-30,2018-01-02,fed_rates,Fed & Interest Rates,sp500,1,0.0516,positive,81369,Twitter,"On Taxes: “This is the biggest corporate rate cut ever, going back to the corporate income tax rate of roughly 80 years ago.This is a huge pro-growth stimulus for the economy. Every year the Obama WH overstated how the economy would grow. Now real economics and jobs.” @WSJ Report",2695.8101,President — 1st Term (2017–2021),In Office,0.0,100000.0,1.9252,101925.21,5.8506,105850.56
2017-12-31,2018-01-02,sp500,S&P 500,sp500,2,0.398,positive,140628,Twitter,"If the Dems (Crooked Hillary) got elected, your stocks would be down 50% from values on Election Day. Now they have a great future - and just beginning! https://twitter.com/realdonaldtrump/status/947328044821336070 …",2695.8101,President — 1st Term (2017–2021),In Office,0.0,100000.0,1.9252,101925.21,4.6969,104696.91
2018-01-02,2018-01-02,fed_rates,Fed & Interest Rates,sp500,1,-0.9414,negative,112215,Twitter,"The people of Iran are finally acting against the brutal and corrupt Iranian regime. All of the money that President Obama so foolishly gave them went into terrorism and into their “pockets.” The people have little food, big inflation and no human rights. The U.S. is watching!",2695.8101,President — 1st Term (2017–2021),In Office,0.6399,100639.88,2.058,102058.0,4.6802,104680.22
2018-01-04,2018-01-04,sp500,S&P 500,sp500,2,0.2711,positive,179632,Twitter,"Stock Market had another good day but, now that the Tax Cut Bill has passed, we have tremendous upward potential. Dow just short of 25,000, a number that few thought would be possible this soon into my administration. Also, unemployment went down to 4.1%. Only getting better!",2723.99,President — 1st Term (2017–2021),In Office,0.7034,100703.38,1.5995,101599.5,-2.7552,97244.85
2018-01-05,2018-01-05,sp500,S&P 500,sp500,1,-0.5696,negative,132867,Twitter,"The Fake News Media barely mentions the fact that the Stock Market just hit another New Record and that business in the U.S. is booming...but the people know! Can you imagine if “O” was president and had these numbers - would be biggest story on earth! Dow now over 25,000.",2743.1499,President — 1st Term (2017–2021),In Office,0.1662,100166.24,1.5708,101570.83,-3.4344,96565.63
2018-01-06,2018-01-08,sp500,S&P 500,sp500,1,-0.9318,negative,119973,Twitter,"Brian Ross, the reporter who made a fraudulent live newscast about me that drove the Stock Market down 350 points (billions of dollars), was suspended for a month but is now back at ABC NEWS in a lower capacity. He is no longer allowed to report on Trump. Should have been fired!",2747.71,President — 1st Term (2017–2021),In Office,0.0,100000.0,1.0449,101044.87,-3.5946,96405.37
2018-01-07,2018-01-08,sp500,S&P 500,sp500,1,0.9279,positive,102010,Twitter,"The Stock Market has been creating tremendous benefits for our country in the form of not only Record Setting Stock Prices, but present and future Jobs, Jobs, Jobs. Seven TRILLION dollars of value created since our big election win!",2747.71,President — 1st Term (2017–2021),In Office,0.0,100000.0,1.0449,101044.87,-1.9132,98086.77
2018-01-13,2018-01-16,sp500,S&P 500,sp500,1,-0.3382,negative,120750,Twitter,"Yesterday was a big day for the stock market. Jobs are coming back to America. Chrysler is coming back to the USA, from Mexico and many others will follow. Tax cut money to employees is pouring into our economy with many more companies announcing. American business is hot again!",2776.4199,President — 1st Term (2017–2021),In Office,0.0,100000.0,2.0368,102036.8,-4.3372,95662.76
2018-01-14,2018-01-16,sp500,S&P 500,sp500,2,0.6573,positive,215722,Twitter,"“President Trump is not getting the credit he deserves for the economy. Tax Cut bonuses to more than 2,000,000 workers. Most explosive Stock Market rally that we’ve seen in modern times. 18,000 to 26,000 from Election, and grounded in profitability and growth. All Trump, not 0...",2776.4199,President — 1st Term (2017–2021),In Office,0.0,100000.0,2.0368,102036.8,-4.0873,95912.72
2018-01-20,2018-01-22,sp500,S&P 500,sp500,1,0.0752,positive,135505,Twitter,"Unprecedented success for our Country, in so many ways, since the Election. Record Stock Market, Strong on Military, Crime, Borders, & ISIS, Judicial Strength & Numbers, Lowest Unemployment for Women & ALL, Massive Tax Cuts, end of Individual Mandate - and so much more. Big 2018!",2832.97,President — 1st Term (2017–2021),In Office,0.0,100000.0,0.7257,100725.74,-4.1197,95880.3
2018-01-25,2018-01-25,israel_mideast,Israel & Middle East,sp500,1,0.0,neutral,75048,Twitter,"Very productive bilateral meeting with Prime Minister Benjamin @Netanyahu of Israel - in Davos, Switzerland! #WEF18 pic.twitter.com/2sZM9YI7tJ",2839.25,President — 1st Term (2017–2021),In Office,1.1841,101184.12,-0.6083,99391.74,-2.1009,97899.1
2018-02-04,2018-02-05,sp500,S&P 500,sp500,1,-0.5994,negative,139318,Twitter,"...a tool of anti-Trump political actors. This is unacceptable in a democracy and ought to alarm anyone who wants the FBI to be a nonpartisan enforcer of the law....The FBI wasn’t straight with Congress, as it hid most of these facts from investigators.” Wall Street Journal",2648.9399,President — 1st Term (2017–2021),In Office,0.0,100000.0,0.2665,100266.53,2.9891,102989.13
2018-02-07,2018-02-07,sp500,S&P 500,sp500,1,0.9049,positive,114309,Twitter,"In the “old days,” when good news was reported, the Stock Market would go up. Today, when good news is reported, the Stock Market goes down. Big mistake, and we have so much good (great) news about the economy!",2681.6599,President — 1st Term (2017–2021),In Office,-3.7536,96246.36,0.6328,100632.82,3.9121,103912.14
2018-02-08,2018-02-08,tariffs_china,Tariffs & China,sp500,1,0.0,neutral,80005,Twitter,"I will be meeting with Henry Kissinger at 1:45pm. Will be discussing North Korea, China and the Middle East.",2581.0,President — 1st Term (2017–2021),In Office,1.4936,101493.61,5.8194,105819.45,7.8272,107827.2
2018-02-12,2018-02-12,israel_mideast,Israel & Middle East,sp500,1,-0.632,negative,143289,Twitter,"This will be a big week for Infrastructure. After so stupidly spending $7 trillion in the Middle East, it is now time to start investing in OUR Country!",2656.0,President — 1st Term (2017–2021),In Office,0.2613,100261.29,2.2688,102268.83,3.5196,103519.58
2018-02-18,2018-02-20,tariffs_china,Tariffs & China,sp500,1,0.2714,positive,134932,Twitter,"I never said Russia did not meddle in the election, I said “it may be Russia, or China or another country or group, or it may be a 400 pound genius sitting in bed and playing with his computer.” The Russian “hoax” was that the Trump campaign colluded with Russia - it never did!",2716.26,President — 1st Term (2017–2021),In Office,0.0,100000.0,2.3319,102331.89,0.025,100025.03
2018-02-22,2018-02-22,sp500,S&P 500,sp500,1,0.7639,positive,197718,Twitter,I will be strongly pushing Comprehensive Background Checks with an emphasis on Mental Health. Raise age to 21 and end sale of Bump Stocks! Congress is in a mood to finally do something on this issue - I hope!,2703.96,President — 1st Term (2017–2021),In Office,1.6028,101602.83,-0.9723,99027.72,-1.6794,98320.61
2018-03-02,2018-03-02,tariffs_china,Tariffs & China,sp500,1,-0.6919,negative,130852,Twitter,"When a country Taxes our products coming in at, say, 50%, and we Tax the same product coming into our country at ZERO, not fair or smart. We will soon be starting RECIPROCAL TAXES so that we will charge the same thing as they charge us. $800 Billion Trade Deficit-have no choice!",2691.25,President — 1st Term (2017–2021),In Office,1.1032,101103.2,3.5419,103541.85,-4.0639,95936.09
2018-03-03,2018-03-05,tariffs_china,Tariffs & China,sp500,2,0.6272,positive,267955,Twitter,The United States has an $800 Billion Dollar Yearly Trade Deficit because of our “very stupid” trade deals and policies. Our jobs and wealth are being given to other countries that have taken advantage of us for years. They laugh at what fools our leaders have been. No more!,2720.9399,President — 1st Term (2017–2021),In Office,0.0,100000.0,2.2816,102281.57,-5.1107,94889.27
2018-03-05,2018-03-05,tariffs_china,Tariffs & China,sp500,1,0.25,positive,85559,Twitter,"We have large trade deficits with Mexico and Canada. NAFTA, which is under renegotiation right now, has been a bad deal for U.S.A. Massive relocation of companies & jobs. Tariffs on Steel and Aluminum will only come off if new & fair NAFTA agreement is signed. Also, Canada must..",2720.9399,President — 1st Term (2017–2021),In Office,0.2639,100263.89,2.2816,102281.57,-2.8023,97197.66
2018-03-07,2018-03-07,tariffs_china,Tariffs & China,sp500,3,-0.1867,negative,231521,Twitter,"From Bush 1 to present, our Country has lost more than 55,000 factories, 6,000,000 manufacturing jobs and accumulated Trade Deficits of more than 12 Trillion Dollars. Last year we had a Trade Deficit of almost 800 Billion Dollars. Bad Policies & Leadership. Must WIN again! #MAGA",2726.8,President — 1st Term (2017–2021),In Office,0.4463,100446.31,0.8317,100831.74,-4.4862,95513.79
2018-03-09,2018-03-09,tariffs_china,Tariffs & China,sp500,1,0.9097,positive,81538,Twitter,"Spoke to PM @TurnbullMalcolm of Australia. He is committed to having a very fair and reciprocal military and trade relationship. Working very quickly on a security agreement so we don’t have to impose steel or aluminum tariffs on our ally, the great nation of Australia!",2786.5701,President — 1st Term (2017–2021),In Office,-0.1274,99872.6,-1.2402,98759.76,-6.2231,93776.93
2018-03-10,2018-03-12,tariffs_china,Tariffs & China,sp500,3,0.0638,positive,274416,Twitter,"The European Union, wonderful countries who treat the U.S. very badly on trade, are complaining about the tariffs on Steel & Aluminum. If they drop their horrific barriers & tariffs on U.S. products going in, we will likewise drop ours. Big Deficit. If not, we Tax Cars etc. FAIR!",2783.02,President — 1st Term (2017–2021),In Office,0.0,100000.0,-2.5189,97481.15,-6.1034,93896.55
2018-03-12,2018-03-12,sp500,S&P 500,sp500,1,0.8947,positive,84429,Twitter,"Very strong improvement and strengthening of background checks will be fully backed by White House. Legislation moving forward. Bump Stocks will soon be out. Highly trained expert teachers will be allowed to conceal carry, subject to State Law. Armed guards OK, deterrent!.......",2783.02,President — 1st Term (2017–2021),In Office,-0.6364,99363.64,-2.5189,97481.15,-5.0603,94939.67
2018-03-15,2018-03-15,tariffs_china,Tariffs & China,sp500,1,0.3157,positive,81719,Twitter,"We do have a Trade Deficit with Canada, as we do with almost all countries (some of them massive). P.M. Justin Trudeau of Canada, a very good guy, doesn’t like saying that Canada has a Surplus vs. the U.S.(negotiating), but they do...they almost all do...and that’s how I know!",2747.3301,President — 1st Term (2017–2021),In Office,0.1703,100170.34,-3.7724,96227.6,-2.5294,97470.64
2018-03-23,2018-03-23,sp500,S&P 500,sp500,1,-0.8647,negative,84808,Twitter,"Obama Administration legalized bump stocks. BAD IDEA. As I promised, today the Department of Justice will issue the rule banning BUMP STOCKS with a mandated comment period. We will BAN all devices that turn legal weapons into illegal machine guns.",2588.26,President — 1st Term (2017–2021),In Office,2.7157,102715.72,-0.2465,99753.5,3.1693,103169.31
2018-03-28,2018-03-28,tariffs_china,Tariffs & China,sp500,1,-0.3609,negative,108218,Twitter,"Received message last night from XI JINPING of China that his meeting with KIM JONG UN went very well and that KIM looks forward to his meeting with me. In the meantime, and unfortunately, maximum sanctions and pressure must be maintained at all cost!",2605.0,President — 1st Term (2017–2021),In Office,1.377,101376.97,1.5236,101523.6,2.4917,102491.74
2018-04-04,2018-04-04,tariffs_china,Tariffs & China,sp500,1,-0.9324,negative,153096,Twitter,"We are not in a trade war with China, that war was lost many years ago by the foolish, or incompetent, people who represented the U.S. Now we have a Trade Deficit of $500 Billion a year, with Intellectual Property Theft of another $300 Billion. We cannot let this continue!",2644.6899,President — 1st Term (2017–2021),In Office,0.6863,100686.29,-0.0945,99905.47,0.7082,100708.21
2018-04-05,2018-04-05,tariffs_china,Tariffs & China,sp500,1,-0.9302,negative,98688,Twitter,"The Fake News Washington Post, Amazon’s “chief lobbyist,” has another (of many) phony headlines, “Trump Defiant As China Adds Trade Penalties.” WRONG! Should read, “Trump Defiant as U.S. Adds Trade Penalties, Will End Barriers And Massive I.P. Theft.” Typically bad reporting!",2662.8401,President — 1st Term (2017–2021),In Office,-2.192,97807.98,0.0432,100043.18,0.3676,100367.65
2018-04-06,2018-04-06,tariffs_china,Tariffs & China,sp500,2,0.405,positive,185957,Twitter,"China, which is a great economic power, is considered a Developing Nation within the World Trade Organization. They therefore get tremendous perks and advantages, especially over the U.S. Does anybody think this is fair. We were badly represented. The WTO is unfair to U.S.",2604.47,President — 1st Term (2017–2021),In Office,0.3337,100333.65,1.99,101990.04,2.617,102617.04
2018-04-07,2018-04-09,tariffs_china,Tariffs & China,sp500,1,-0.6996,negative,95227,Twitter,"The United States hasn’t had a Trade Surplus with China in 40 years. They must end unfair trade, take down barriers and charge only Reciprocal Tariffs. The U.S. is losing $500 Billion a year, and has been losing Billions of Dollars for decades. Cannot continue!",2613.1599,President — 1st Term (2017–2021),In Office,0.0,100000.0,2.4752,102475.17,2.2758,102275.79
2018-04-08,2018-04-09,tariffs_china,Tariffs & China,sp500,1,0.8409,positive,112120,Twitter,"President Xi and I will always be friends, no matter what happens with our dispute on trade. China will take down its Trade Barriers because it is the right thing to do. Taxes will become Reciprocal & a deal will be made on Intellectual Property. Great future for both countries!",2613.1599,President — 1st Term (2017–2021),In Office,0.0,100000.0,2.4752,102475.17,2.2486,102248.62
2018-04-09,2018-04-09,tariffs_china,Tariffs & China,sp500,1,0.8849,positive,190746,Twitter,"When a car is sent to the United States from China, there is a Tariff to be paid of 2 1/2%. When a car is sent to China from the United States, there is a Tariff to be paid of 25%. Does that sound like free or fair trade. No, it sounds like STUPID TRADE - going on for years!",2613.1599,President — 1st Term (2017–2021),In Office,1.6727,101672.7,2.4752,102475.17,3.2386,103238.61
2018-04-10,2018-04-10,tariffs_china,Tariffs & China,sp500,1,0.9577,positive,109922,Twitter,"Very thankful for President Xi of China’s kind words on tariffs and automobile barriers...also, his enlightenment on intellectual property and technology transfers. We will make great progress together!",2656.8701,President — 1st Term (2017–2021),In Office,-0.5525,99447.46,1.8638,101863.84,2.4917,102491.65
2018-04-11,2018-04-11,tariffs_china,Tariffs & China,sp500,1,0.0038,neutral,72271,Twitter,"So much Fake News about what is going on in the White House. Very calm and calculated with a big focus on open and fair trade with China, the coming North Korea meeting and, of course, the vicious gas attack in Syria. Feels great to have Bolton & Larry K on board. I (we) are",2642.1899,President — 1st Term (2017–2021),In Office,0.8251,100825.08,2.515,102514.96,3.2371,103237.09
2018-04-16,2018-04-16,tariffs_china,Tariffs & China,sp500,1,0.4819,positive,101366,Twitter,Russia and China are playing the Currency Devaluation game as the U.S. keeps raising interest rates. Not acceptable!,2677.8401,President — 1st Term (2017–2021),In Office,1.0662,101066.15,-0.2819,99718.05,1.6663,101666.26
2018-04-18,2018-04-18,israel_mideast,Israel & Middle East,sp500,1,0.7377,positive,107733,Twitter,Best wishes to Prime Minister @Netanyahu and all of the people of Israel on the 70th Anniversary of your Great Independence. We have no better friends anywhere. Looking forward to moving our Embassy to Jerusalem next month!,2708.6399,President — 1st Term (2017–2021),In Office,-0.5726,99427.39,-2.5563,97443.74,0.1599,100159.86
2018-04-21,2018-04-23,sp500,S&P 500,sp500,1,0.6808,positive,93651,Twitter,“At least two Memos Comey shared with a friend contained Classified Information.” Wall Street Journal,2670.29,President — 1st Term (2017–2021),In Office,0.0,100000.0,-0.8329,99167.13,2.3488,102348.81
