event_date,buy_date,topic,topic_display,instrument,post_count,avg_sentiment,sentiment_label,total_engagement,platform,headline_text,buy_price,presidency_era,in_office,return_1d_pct,value_1d,return_1w_pct,value_1w,return_1m_pct,value_1m
2010-06-28,2010-06-28,sp500,S&P 500,sp500,1,0.6249,positive,36,Twitter,"""Trading Shots with Donald Trump""--a great article in the Wall Street Journal  http://bit.ly/c9eZbq",1074.5699,Not President (Pre-2017),Not In Office,-3.1017,96898.3,-4.3282,95671.78,2.937,102937.0
2011-01-27,2011-01-27,tariffs_china,Tariffs & China,sp500,1,0.0,neutral,311,Twitter,THe people at shouldtrumprun.com have got it right! How are our factories supposed to compete with China and other countries...,1299.54,Not President (Pre-2017),Not In Office,-1.7852,98214.75,0.5817,100581.74,2.13,102129.98
2011-07-07,2011-07-07,israel_mideast,Israel & Middle East,sp500,1,0.0772,positive,489,Twitter,If only @Obama was as focused on balancing the budget as he is on weakening Israel's borders then America would be on the path to solvency.,1353.22,Not President (Pre-2017),Not In Office,-0.6961,99303.88,-3.2774,96722.63,-17.2744,82725.65
2011-07-14,2011-07-14,israel_mideast,Israel & Middle East,sp500,1,-0.3421,negative,520,Twitter,"@BarackObama You have abandoned Israel and engaged the Muslim Brotherhood, and even the Arab world does not like it http://politi.co/qUTXsA ",1308.87,Not President (Pre-2017),Not In Office,0.5554,100555.44,2.6687,102668.71,-7.9748,92025.18
2011-07-18,2011-07-18,tariffs_china,Tariffs & China,sp500,1,0.4753,positive,496,Twitter,Every dollar @BarackObama spends costs $1.40 with interest borrowed from China on our children and grandchildren's backs. CUT-CAP-BALANCE!,1305.4399,Not President (Pre-2017),Not In Office,1.6309,101630.88,2.4505,102450.53,-8.545,91455.0
2011-07-19,2011-07-19,tariffs_china,Tariffs & China,sp500,1,-0.5574,negative,445,Twitter,So China is ordering us to raise the Debt Limit...How low have we as a nation sunk?,1326.73,Not President (Pre-2017),Not In Office,-0.0671,99932.92,0.3927,100392.69,-14.0255,85974.54
2011-07-20,2011-07-20,tariffs_china,Tariffs & China,sp500,1,-0.4939,negative,1578,Twitter,"""China is our enemy--they want to destroy us"" -- Redstate Interview",1325.84,Not President (Pre-2017),Not In Office,1.3546,101354.61,-1.5801,98419.87,-15.259,84740.99
2011-07-27,2011-07-27,tariffs_china,Tariffs & China,sp500,1,-0.8172,negative,306,Twitter,China has so much of our debt that they can't put us in default w/o killing themselves---US needs our toughest negotiator---and fast!,1304.89,Not President (Pre-2017),Not In Office,-0.3234,99676.6,-3.4141,96585.92,-9.8162,90183.85
2011-07-28,2011-07-28,tariffs_china,Tariffs & China,sp500,1,-0.5994,negative,129,Twitter,"@KarlRove's @CrossroadsGPS new ad criticizes Obama for his excessive spending and debt, borrowing from China. Didn't Bush do the same thing?",1300.67,Not President (Pre-2017),Not In Office,-0.6451,99354.95,-7.7345,92265.52,-6.9649,93035.13
2011-08-03,2011-08-03,tariffs_china,Tariffs & China,sp500,1,0.0,neutral,3752,Twitter,Wake Up America -- China is eating our lunch.,1260.34,Not President (Pre-2017),Not In Office,-4.7821,95217.95,-11.0748,88925.21,-6.8529,93147.09
2011-08-04,2011-08-04,tariffs_china,Tariffs & China,sp500,1,-0.5267,negative,207,Twitter,China demanded that we raise our debt ceiling and then their rating agency downgraded us. Our leaders are hope… (cont) http://deck.ly/~x0TDx,1200.0699,Not President (Pre-2017),Not In Office,-0.0575,99942.51,-2.2857,97714.31,-2.9023,97097.68
2011-08-08,2011-08-08,sp500,S&P 500,sp500,1,0.3818,positive,500,Twitter,The S&P downgrade is a direct result of @BarackObama's increased reckless budget spending and Obama Care. He owns this.,1119.46,Not President (Pre-2017),Not In Office,4.7407,104740.68,7.5956,107595.63,7.0713,107071.27
2011-08-09,2011-08-09,sp500,S&P 500,sp500,2,-0.379,negative,272,Twitter,The S&P are losers. They did this for personal publicity in order to straighten out their terrible reputatio… (cont) http://deck.ly/~PgL6v,1172.53,Not President (Pre-2017),Not In Office,-4.4152,95584.76,1.7253,101725.33,1.1403,101140.27
2011-08-10,2011-08-10,fed_rates,Fed & Interest Rates,sp500,1,-0.4767,negative,2077,Twitter,The Fed continues to flood the market with US dollars. Wrong move.,1120.76,Not President (Pre-2017),Not In Office,4.629,104629.0,6.525,106525.04,2.9864,102986.37
2011-08-13,2011-08-15,tariffs_china,Tariffs & China,sp500,1,0.4408,positive,238,Twitter,"Mike Huckebee, a great guy, said the President should appoint me Treasury Secretary. China and OPEC would not be happy.",1204.49,Not President (Pre-2017),Not In Office,0.0,100000.0,-6.6974,93302.55,-3.5052,96494.78
2011-08-15,2011-08-15,tariffs_china,Tariffs & China,sp500,1,-0.7208,negative,16393,Twitter,China is a threat to America. They are not our friend.,1204.49,Not President (Pre-2017),Not In Office,-0.9739,99026.14,-6.6974,93302.55,-1.3126,98687.42
2011-08-16,2011-08-16,tariffs_china,Tariffs & China,sp500,1,0.0,neutral,175,Twitter,China owes us money.... http://bit.ly/mWTiBH  #trumpvlog,1192.76,Not President (Pre-2017),Not In Office,0.0947,100094.74,-2.5495,97450.45,1.3708,101370.77
2011-08-19,2011-08-19,tariffs_china,Tariffs & China,sp500,2,0.4811,positive,1238,Twitter,@BarackObama is sure a master delegator. He has sent @Joe_Biden to China. The Chinese are laughing at us. We MUST do better.,1123.53,Not President (Pre-2017),Not In Office,0.0258,100025.8,4.7413,104741.31,7.1703,107170.26
2011-08-22,2011-08-22,israel_mideast,Israel & Middle East,sp500,1,0.128,positive,187,Twitter,Israel is being barraged by rockets from Gaza recently. They must respond accordingly in defense of their citizens.,1123.8199,Not President (Pre-2017),Not In Office,3.4285,103428.49,7.6756,107675.62,3.8209,103820.91
2011-08-24,2011-08-24,tariffs_china,Tariffs & China,sp500,1,-0.6249,negative,516,Twitter,"Just as I predicted, @Joe_Biden was a complete disaster in China. He condoned the Chinese one-child policy an… (cont) http://deck.ly/~sjayl ",1177.6,Not President (Pre-2017),Not In Office,-1.5566,98443.44,3.5063,103506.28,-3.4961,96503.91
2011-08-25,2011-08-25,tariffs_china,Tariffs & China,sp500,1,-0.6486,negative,288,Twitter,"China's corporate espionage is a continued threat to the American economy. With the right leadership, it can be stopped.",1159.27,Not President (Pre-2017),Not In Office,1.5122,101512.16,3.8947,103894.69,0.3174,100317.44
2011-08-29,2011-08-29,israel_mideast,Israel & Middle East,sp500,1,-0.6597,negative,1575,Twitter,If the Palestinians want statehood then why are they run by the terrorist group Hamas?,1210.08,Not President (Pre-2017),Not In Office,0.2347,100234.7,-3.7055,96294.46,-4.8774,95122.64
2011-08-30,2011-08-30,tariffs_china,Tariffs & China,sp500,1,0.2732,positive,200,Twitter,China's business interests reach far and wide---even domestically within our borders. We need to reassess our relationship.,1212.92,Not President (Pre-2017),Not In Office,0.4922,100492.2,-3.931,96068.99,-4.33,95669.95
2011-09-01,2011-09-01,israel_mideast,Israel & Middle East,sp500,1,-0.3612,negative,340,Twitter,We must stand firm against the UN's ploy to sabotage Israel---if the UN grants the PA statehood then we must immediately defund it.,1204.42,Not President (Pre-2017),Not In Office,-2.5282,97471.81,-1.5377,98462.33,-8.7337,91266.34
2011-09-06,2011-09-06,israel_mideast,Israel & Middle East,sp500,1,-0.4767,negative,278,Twitter,The UN is about to use its Assembly to attack @Israel. We should defund the UN entirely if they can't act resp… (cont) http://deck.ly/~VKD5c ,1165.24,Not President (Pre-2017),Not In Office,2.8646,102864.65,0.6548,100654.8,-0.0232,99976.83
2011-09-08,2011-09-08,tariffs_china,Tariffs & China,sp500,1,0.7717,positive,698,Twitter,China is happy to learn that @BarackObama plans to borrow another $300 Billion. @BarackObama is their favorite client.,1185.9,Not President (Pre-2017),Not In Office,-2.6705,97329.45,1.9572,101957.16,0.7581,100758.07
2011-09-13,2011-09-13,israel_mideast,Israel & Middle East,sp500,2,0.6129,positive,301,Twitter,"Friends in NY-9, let @BarackObama know that you don't approve of his mistreatment of @Israel. Vote for @Bobturner9th tomorrow!",1172.87,Not President (Pre-2017),Not In Office,1.348,101347.98,2.4913,102491.32,2.6252,102625.18
2011-09-14,2011-09-14,tariffs_china,Tariffs & China,sp500,1,-0.5106,negative,47,Twitter,My interview yesterday with @TeamCavuto where I discuss Dick Cheney and China http://bit.ly/pzfJd7 ,1188.6801,Not President (Pre-2017),Not In Office,1.7187,101718.7,-1.8441,98155.93,3.0201,103020.15
2011-09-15,2011-09-15,sp500,S&P 500,sp500,1,0.3382,positive,92,Twitter,Can you imagine if @BarackObama had passed Cap and Trade?! Energy costs would be double from already record highs.,1209.11,Not President (Pre-2017),Not In Office,0.5707,100570.67,-6.5792,93420.79,-0.6823,99317.68
2011-09-16,2011-09-16,israel_mideast,Israel & Middle East,sp500,1,0.9201,positive,306,Twitter,I applaud @netanyahu for announcing that he will show up at the UN to defend @Israel. A true US friend and great leader.,1216.01,Not President (Pre-2017),Not In Office,-0.9803,99019.74,-6.5443,93455.65,-1.2459,98754.12
2011-09-19,2011-09-19,israel_mideast,Israel & Middle East,sp500,1,0.0,neutral,102,Twitter,I am increasingly concerned with the UN's ploy against @Israel this coming week and will monitor all events closely from Australia.,1204.09,Not President (Pre-2017),Not In Office,-0.1661,99833.9,-3.4167,96583.31,0.4809,100480.86
2011-09-21,2011-09-21,tariffs_china,Tariffs & China,sp500,2,-0.1094,negative,4978,Twitter,China is neither an ally or a friend--they want to beat us and own our country.,1166.76,Not President (Pre-2017),Not In Office,-3.1883,96811.69,-1.3456,98654.4,6.1272,106127.22
2011-09-23,2011-09-23,tariffs_china,Tariffs & China,sp500,1,0.1779,positive,370,Twitter,Our deficit spending is China’s gain. @BarackObama is bankrupting our country.,1136.4301,Not President (Pre-2017),Not In Office,2.3336,102333.61,-0.4409,99559.14,10.3623,110362.26
2011-09-28,2011-09-28,tariffs_china,Tariffs & China,sp500,1,-0.836,negative,542,Twitter,China is stealing our jobs. We need to demand China stop manipulating its currency and end its rampant corporate espionage.,1151.0601,Not President (Pre-2017),Not In Office,0.8114,100811.42,-0.6108,99389.25,11.644,111644.04
2011-09-29,2011-09-29,fed_rates,Fed & Interest Rates,sp500,1,-0.4019,negative,2710,Twitter,The Fed's reckless policies of low interest and flooding the market with dollars needs to be stopped or we will face record inflation.,1160.4,Not President (Pre-2017),Not In Office,-2.4974,97502.59,0.3938,100393.83,8.0059,108005.86
2011-10-06,2011-10-06,israel_mideast,Israel & Middle East,sp500,1,-0.4939,negative,537,Twitter,Why is the UN condemning @Israel and doing nothing about Syria? What a disgrace.,1164.97,Not President (Pre-2017),Not In Office,-0.8163,99183.67,3.3211,103321.12,8.2534,108253.43
2011-10-11,2011-10-11,fed_rates,Fed & Interest Rates,sp500,1,-0.1531,negative,524,Twitter,The Fed's reckless monetary policy is going to create record inflation.,1195.54,Not President (Pre-2017),Not In Office,0.9795,100979.47,2.4959,102495.94,3.6937,103693.73
2011-10-12,2011-10-12,tariffs_china,Tariffs & China,sp500,1,0.0,neutral,110,Twitter,Mitt Romney is right about the Chinese rip-off of America.,1207.25,Not President (Pre-2017),Not In Office,-0.2974,99702.63,0.2179,100217.85,4.6883,104688.34
2011-10-14,2011-10-14,sp500,S&P 500,sp500,1,-0.7635,negative,489,Twitter,If the Wall Street protesters are upset about the economy then they should really be protesting @BarackObama at the White House.,1224.58,Not President (Pre-2017),Not In Office,-1.937,98063.01,1.1163,101116.3,2.2212,102221.17
2011-10-17,2011-10-17,tariffs_china,Tariffs & China,sp500,2,-0.2101,negative,270,Twitter,China's military buildup is a major threat to the Free World. We must remain resolute and maintain our national defense at all costs.,1200.86,Not President (Pre-2017),Not In Office,2.0419,102041.87,4.441,104440.98,3.002,103002.02
2011-10-18,2011-10-18,tariffs_china,Tariffs & China,sp500,2,-0.1237,negative,353,Twitter,@BarackObama is holding Taiwan's request for 66 advanced F-16's. Wrong message to send to China.,1225.38,Not President (Pre-2017),Not In Office,-1.2649,98735.09,0.2995,100299.5,-0.7549,99245.13
2011-10-19,2011-10-19,tariffs_china,Tariffs & China,sp500,1,-0.1531,negative,180,Twitter,Both @BarackObama and China have embraced OWS. All want the decline of America. Time for the protesters to go home.,1209.88,Not President (Pre-2017),Not In Office,0.4554,100455.42,2.6548,102654.81,0.4769,100476.91
2011-10-21,2011-10-21,tariffs_china,Tariffs & China,sp500,1,-0.7922,negative,626,Twitter,"Why do we continue to sit idly by while China steals our national security and corporate secrets? China is an enemy, not a friend.",1238.25,Not President (Pre-2017),Not In Office,1.2873,101287.29,3.7828,103782.76,-3.656,96344.03
2011-10-24,2011-10-24,fed_rates,Fed & Interest Rates,sp500,1,-0.2732,negative,370,Twitter,The Dollar is at an all-time WWII low against the Yen. The Fed's recklessness is going to lead to record inflation.,1254.1899,Not President (Pre-2017),Not In Office,-2.0045,97995.53,-0.071,99929.05,-7.3673,92632.7
2011-10-25,2011-10-25,fed_rates,Fed & Interest Rates,sp500,1,-0.1531,negative,334,Twitter,Printing money is neither a short or long term solution to our country's economic woes. The Fed is destroyin… (cont) http://deck.ly/~lLQsV ,1229.05,Not President (Pre-2017),Not In Office,1.0537,101053.66,-0.8763,99123.71,-5.7264,94273.63
2011-10-26,2011-10-26,tariffs_china,Tariffs & China,sp500,1,-0.7351,negative,215,Twitter,When will Washington stand up to China. China is manipulating its currency and stealing our jobs. Washington should move on legislation.,1242.0,Not President (Pre-2017),Not In Office,3.4291,103429.15,-0.3301,99669.89,-6.7093,93290.66
2011-11-01,2011-11-01,tariffs_china,Tariffs & China,sp500,1,0.0,neutral,283,Twitter,THe Chinese military is already hacking our satellites http://reut.rs/vFvKYW . The Chinese government is not an American ally.,1218.28,Not President (Pre-2017),Not In Office,1.6105,101610.47,4.7313,104731.26,2.1588,102158.78
2011-11-02,2011-11-02,israel_mideast,Israel & Middle East,sp500,1,0.3818,positive,290,Twitter,"Egypt's Muslim Brotherhood just made its first visit to Hamas-led Gaza. Why did @BarackObama promote the ""Arab Spring""?",1237.9,Not President (Pre-2017),Not In Office,1.8782,101878.18,-0.7109,99289.12,0.5154,100515.39
2011-11-04,2011-11-04,tariffs_china,Tariffs & China,sp500,1,-0.3724,negative,116,Twitter,"China 'scorns' US cyber espionage charges--China does not respect us http://reut.rs/vloYTi  and feels Obama is a ""dummy""",1253.23,Not President (Pre-2017),Not In Office,0.6296,100629.57,0.8474,100847.41,0.3072,100307.21
2011-11-08,2011-11-08,sp500,S&P 500,sp500,1,-0.5709,negative,227,Twitter,A record high 6.7% of Americans are living in extreme poverty. This is tragic. We can do better.,1275.92,Not President (Pre-2017),Not In Office,-3.6695,96330.49,-1.4194,98580.64,-3.258,96741.96
2011-11-09,2011-11-09,israel_mideast,Israel & Middle East,sp500,2,-0.0211,neutral,625,Twitter,"Instead of trash talking @PMIsrael on the world stage, @BarackObama should be defending @Israel.",1229.1,Not President (Pre-2017),Not In Office,0.8624,100862.42,0.6354,100635.42,2.1227,102122.68
2011-11-10,2011-11-10,fed_rates,Fed & Interest Rates,sp500,1,-0.4997,negative,269,Twitter,"The Fed should not bail out the EU. Europe's financial mess is their problem, not our problem!",1239.7,Not President (Pre-2017),Not In Office,1.9481,101948.05,-1.9013,98098.73,-0.2605,99739.45
2011-11-11,2011-11-11,israel_mideast,Israel & Middle East,sp500,2,0.0,neutral,403,Twitter,The Arab Spring has turned into the Islamist Winter. Our ally @Israel is in a perilous position. We must stand behind @Israel.,1263.85,Not President (Pre-2017),Not In Office,-0.955,99044.98,-3.8137,96186.26,-2.1664,97833.6
2011-11-14,2011-11-14,tariffs_china,Tariffs & China,sp500,1,-0.2263,negative,98,Twitter,@BarackObama delayed the Keystone pipeline decision until 2013. Now Canada is looking to export more oil to China. http://bit.ly/uCGpeC ,1251.78,Not President (Pre-2017),Not In Office,0.4817,100481.72,-4.6973,95302.69,-3.1923,96807.74
2011-11-17,2011-11-17,tariffs_china,Tariffs & China,sp500,1,-0.2023,negative,354,Twitter,"China is complaining about 2,500 marines being placed in Australia. Meanwhile they are building bases across Latin America. #TimeToGetTough",1216.13,Not President (Pre-2017),Not In Office,-0.0395,99960.53,-4.7248,95275.18,-0.8864,99113.58
2011-11-18,2011-11-18,tariffs_china,Tariffs & China,sp500,1,-0.4767,negative,447,Twitter,Why is @BarackObama delaying the sale of F-16 aircraft to Taiwan? Wrong message to send to China. #TimeToGetTough,1215.65,Not President (Pre-2017),Not In Office,-1.8648,98135.15,-4.6872,95312.8,-0.8473,99152.72
2011-11-21,2011-11-21,tariffs_china,Tariffs & China,sp500,1,0.0,neutral,221,Twitter,China's economy is now projected to overtake the US as the world's largest economy by 2027 http://tgr.ph/uSvGQ4  #TimeToGetTough,1192.98,Not President (Pre-2017),Not In Office,-0.4141,99585.91,-0.036,99963.96,4.2532,104253.21
2011-11-22,2011-11-22,tariffs_china,Tariffs & China,sp500,2,-0.3382,negative,526,Twitter,Why are we giving China foreign aid? Couldn't the Super Committee have agreed to at least cut that outlay? #TimeToGetTough,1188.04,Not President (Pre-2017),Not In Office,-2.2095,97790.48,0.6018,100601.82,5.552,105552.0
2011-11-23,2011-11-23,tariffs_china,Tariffs & China,sp500,1,0.3374,positive,184,Twitter,American sanctions alone cannot stop Iran's nuclear drive--and @BarackObama cannot get China and Russia to agree on new Iranian sanctions.,1161.79,Not President (Pre-2017),Not In Office,-0.2686,99731.45,7.3309,107330.93,8.9121,108912.11
2011-11-28,2011-11-28,tariffs_china,Tariffs & China,sp500,1,0.4404,positive,110,Twitter,Washington will continue to run record deficits into the election. We are borrowing at a rate of $1.40 from China. Truly unsustainable.,1192.55,Not President (Pre-2017),Not In Office,0.2214,100221.37,5.4111,105411.09,4.7872,104787.22
2011-11-29,2011-11-29,tariffs_china,Tariffs & China,sp500,1,0.5267,positive,296,Twitter,America's trade deficit with China is one of our greatest national security threats. Time for Fair Trade. We must produce our own products.,1195.1899,Not President (Pre-2017),Not In Office,4.3315,104331.54,5.2946,105294.56,5.6753,105675.26
2011-11-30,2011-11-30,tariffs_china,Tariffs & China,sp500,1,0.7003,positive,64,Twitter,China is so brazen that they now give us economic advice--they tell us what to do---much like a strong stockh… (cont) http://deck.ly/~ltB8C ,1246.96,Not President (Pre-2017),Not In Office,-0.1909,99809.14,1.1267,101126.74,0.8533,100853.28
2011-12-01,2011-12-01,fed_rates,Fed & Interest Rates,sp500,1,-0.0258,neutral,443,Twitter,The Fed continues to recklessly flood the market with dollars. This will eventually create record inflation. It has to stop. #TimeToGetTough,1244.58,Not President (Pre-2017),Not In Office,-0.0241,99975.9,-0.822,99178.04,2.6097,102609.72
2011-12-02,2011-12-02,tariffs_china,Tariffs & China,sp500,2,0.6987,positive,2074,Twitter,"We are building China's wealth by buying all their products, even though we make better products in America.",1244.28,Not President (Pre-2017),Not In Office,1.0287,101028.71,0.8768,100876.8,2.6345,102634.46
2011-12-05,2011-12-05,tariffs_china,Tariffs & China,sp500,1,-0.0572,negative,102,Twitter,#TimeToGetTough: Making America #1 Again--my new book--available today. The book both China and OPEC do NOT want you to read.,1257.08,Not President (Pre-2017),Not In Office,0.1106,100110.57,-1.6395,98360.49,1.6085,101608.49
2011-12-08,2011-12-08,israel_mideast,Israel & Middle East,sp500,1,0.0,neutral,34,Twitter,"A clip of my upcoming interview with @DavidBrody discussing #TimeToGetTough, @Israel and the Islamist winter http://bit.ly/sxAlEe ",1234.35,Not President (Pre-2017),Not In Office,1.6883,101688.33,-1.5069,98493.13,3.755,103755.01
2011-12-09,2011-12-09,tariffs_china,Tariffs & China,sp500,1,0.1531,positive,36,Twitter,"#TimeToGetTough presents bold solutions on taxes, national security, the debt, dealing with OPEC and China and defeating @BarackObama.",1255.1899,Not President (Pre-2017),Not In Office,-1.4914,98508.6,-2.8306,97169.36,2.0324,102032.37
2011-12-12,2011-12-12,tariffs_china,Tariffs & China,sp500,2,0.1132,positive,661,Twitter,Why did @BarackObama let Iran keep our drone? Now it is going straight to the Chinese. He should have taken it out.,1236.47,Not President (Pre-2017),Not In Office,-0.8686,99131.4,-2.5168,97483.16,4.5298,104529.83
2011-12-14,2011-12-14,tariffs_china,Tariffs & China,sp500,1,0.4588,positive,132,Twitter,"The Mullahs laughed when @BarackObama ""asked"" Iran to return our drone--they will show it to China first.",1211.8199,Not President (Pre-2017),Not In Office,0.3243,100324.31,2.6324,102632.41,6.3764,106376.37
2011-12-15,2011-12-15,tariffs_china,Tariffs & China,sp500,1,0.4939,positive,103,Twitter,#trumpvlog China is laughing.... http://youtu.be/Iyae36yHp54 ,1215.75,Not President (Pre-2017),Not In Office,0.3216,100321.61,3.1462,103146.21,6.4092,106409.21
2011-12-16,2011-12-16,tariffs_china,Tariffs & China,sp500,3,-0.2976,negative,400,Twitter,China just put a tariff on US cars and trucks--22%--China is laughing at our inept leaders. @BarackObama,1219.66,Not President (Pre-2017),Not In Office,-1.1733,98826.72,3.7445,103744.49,6.0681,106068.08
2011-12-19,2011-12-19,tariffs_china,Tariffs & China,sp500,3,-0.1468,negative,103,Twitter,Our diplomats are weak: @JonHuntsman's China policy proves why we need businesmen to negotiate against China.,1205.35,Not President (Pre-2017),Not In Office,2.9825,102982.54,4.9845,104984.45,8.5195,108519.52
2011-12-20,2011-12-20,tariffs_china,Tariffs & China,sp500,1,0.0,neutral,420,Twitter,China taxing imports from the US --22%-- why aren't we taxing China?,1241.3,Not President (Pre-2017),Not In Office,0.195,100194.96,1.9439,101943.94,5.897,105897.04
2011-12-22,2011-12-22,israel_mideast,Israel & Middle East,sp500,1,0.4937,positive,251,Twitter,"The Keystone pipeline will create 20,000 jobs and make us less energy dependent from the Middle East. @BarackObama says No!",1254.0,Not President (Pre-2017),Not In Office,0.9035,100903.51,0.7193,100719.3,4.9442,104944.18
2011-12-27,2011-12-27,tariffs_china,Tariffs & China,sp500,2,-0.2775,negative,408,Twitter,China hacked the U.S. Chamber of Commerce and now has the information of all 3 million members. China keeps (cont) http://tl.gd/evpm0i ,1265.4301,Not President (Pre-2017),Not In Office,-1.2478,98752.2,0.9191,100919.06,4.1883,104188.3
2011-12-28,2011-12-28,fed_rates,Fed & Interest Rates,sp500,1,-0.6597,negative,475,Twitter,The Fed's reckless monetary policies will cause problems in the years to come. The Fed has to be reined in or we will soon be Greece.,1249.64,Not President (Pre-2017),Not In Office,1.0707,101070.71,2.2134,102213.44,5.3367,105336.74
2011-12-30,2011-12-30,tariffs_china,Tariffs & China,sp500,1,-0.4019,negative,305,Twitter,When will the US government finally classify China as a currency manipulator? China is robbing us blind and @BarackObama defends them.,1257.6,Not President (Pre-2017),Not In Office,1.5474,101547.4,1.607,101607.04,4.406,104406.01
2012-01-03,2012-01-03,sp500,S&P 500,sp500,1,-0.6124,negative,103,Twitter,"""The Wall Street Journal has reported that Obama's food stamp policies are ushering in a massive 'food stamp crime wave.'"" #TimeToGet Tough",1277.0601,Not President (Pre-2017),Not In Office,0.0188,100018.79,1.1761,101176.13,3.7962,103796.21
2012-01-04,2012-01-04,tariffs_china,Tariffs & China,sp500,1,-0.0772,negative,225,Twitter,"""Under President @BarackObama, China has experienced unusually fast gains and America unusually fast losses."" #TimeToGetTough",1277.3,Not President (Pre-2017),Not In Office,0.2944,100294.38,1.1884,101188.44,5.2924,105292.41
2012-01-05,2012-01-05,tariffs_china,Tariffs & China,sp500,1,0.0772,positive,92,Twitter,China is driving the price of gold up in order to ease pressure against Iranian sanctions. http://bit.ly/zTIER0 ,1281.0601,Not President (Pre-2017),Not In Office,-0.2537,99746.3,1.1272,101127.18,4.9389,104938.87
2012-01-06,2012-01-06,tariffs_china,Tariffs & China,sp500,1,0.4588,positive,114,Twitter,"""Getting China to stop playing its currency charades can begin whenever we elect a president ready to take decisive action."" #TimeToGetTough",1277.8101,Not President (Pre-2017),Not In Office,0.2262,100226.16,0.8828,100882.75,5.2058,105205.77
2012-01-12,2012-01-12,tariffs_china,Tariffs & China,sp500,1,0.0,neutral,110,Twitter,The US is always getting ripped off! China gets cheap oil from Iran and Iraq as US pays for Hormuz Patrols to (cont) http://tl.gd/f9uvoa ,1295.5,Not President (Pre-2017),Not In Office,-0.4948,99505.21,1.4666,101466.62,4.3435,104343.5
2012-01-17,2012-01-17,tariffs_china,Tariffs & China,sp500,2,0.0,neutral,150,Twitter,@BarackObama won’t approve the Keystone Pipeline so Canada is now looking to sell their oil to China (cont) http://tl.gd/fd0h00 ,1293.67,Not President (Pre-2017),Not In Office,1.1108,101110.79,1.6217,101621.74,4.9758,104975.77
2012-01-18,2012-01-18,tariffs_china,Tariffs & China,sp500,1,-0.6369,negative,108,Twitter,"“China presents three big threats to the United States in its outrageous currency manipulation, its systematic (cont) http://tl.gd/fdjjc3 ",1308.04,Not President (Pre-2017),Not In Office,0.4939,100493.87,1.3776,101377.64,4.0664,104066.39
