event_date,buy_date,topic,topic_display,instrument,post_count,avg_sentiment,sentiment_label,total_engagement,platform,headline_text,buy_price,presidency_era,in_office,return_1d_pct,value_1d,return_1w_pct,value_1w,return_1m_pct,value_1m
2020-05-10,2020-05-11,tariffs_china,Tariffs & China,sp500,2,-0.7374,negative,286976,Twitter,"We are getting great marks for the handling of the CoronaVirus pandemic, especially the very early BAN of people from China, the infectious source, entering the USA. Compare that to the Obama/Sleepy Joe disaster known as H1N1 Swine Flu. Poor marks, bad polls - didn’t have a clue!",2930.1899,President — 1st Term (2017–2021),In Office,0.0,100000.0,0.8095,100809.5,9.453,109452.97
2020-05-12,2020-05-12,tariffs_china,Tariffs & China,sp500,1,-0.8912,negative,221766,Twitter,"Asian Americans are VERY angry at what China has done to our Country, and the World. Chinese Americans are the most angry of all. I don’t blame them!",2870.1201,President — 1st Term (2017–2021),In Office,-1.7463,98253.73,1.8403,101840.33,4.5984,104598.41
2020-05-13,2020-05-13,sp500,S&P 500,sp500,1,-0.296,negative,217520,Twitter,“Newly released documents show Schiff knew all along there was no proof of Russia-Trump collusion.” Wall Street Journal,2820.0,President — 1st Term (2017–2021),In Office,1.1525,101152.48,5.3762,105376.24,7.8479,107847.88
2020-05-16,2020-05-18,tariffs_china,Tariffs & China,sp500,3,0.2339,positive,392072,Twitter,"Why is it that China, for decades, and with a population much bigger than ours, is paying a tiny fraction of $’s to The World Health Organization, The United Nations and, worst of all, The World Trade Organization, where they are considered a so-called “developing country” and...",2953.9099,President — 1st Term (2017–2021),In Office,0.0,100000.0,1.2817,101281.69,3.8146,103814.61
2020-05-18,2020-05-18,sp500,S&P 500,sp500,1,0.3818,positive,101158,Twitter,"The Wall Street Journal Editorial states that it doesn’t want me to act in an “impulsive” manner in Afghanistan. Could somebody please explain to them that we have been there for 19 years, and while soldier counts are way down now, hardly impulsive. Besides, the Taliban is.....",2953.9099,President — 1st Term (2017–2021),In Office,-1.0484,98951.56,1.2817,101281.69,5.4023,105402.33
2020-05-20,2020-05-20,tariffs_china,Tariffs & China,sp500,1,-0.902,negative,316753,Twitter,"Some wacko in China just released a statement blaming everybody other than China for the Virus which has now killed hundreds of thousands of people. Please explain to this dope that it was the “incompetence of China”, and nothing else, that did this mass Worldwide killing!",2971.6101,President — 1st Term (2017–2021),In Office,-0.7774,99222.64,2.1712,102171.21,4.2445,104244.5
2020-05-21,2020-05-21,tariffs_china,Tariffs & China,sp500,2,-0.1223,negative,458265,Twitter,"China is on a massive disinformation campaign because they are desperate to have Sleepy Joe Biden win the presidential race so they can continue to rip-off the United States, as they have done for decades, until I came along!",2948.51,President — 1st Term (2017–2021),In Office,0.2354,100235.37,2.7546,102754.61,5.7436,105743.58
2020-05-25,2020-05-26,tariffs_china,Tariffs & China,sp500,3,-0.0681,negative,501829,Twitter,"Nobody in 50 years has been WEAKER on China than Sleepy Joe Biden. He was asleep at the wheel. He gave them EVERYTHING they wanted, including rip-off Trade Deals. I am getting it all back!",2991.77,President — 1st Term (2017–2021),In Office,0.0,100000.0,2.1379,102137.86,1.9574,101957.37
2020-05-26,2020-05-26,tariffs_china,Tariffs & China,sp500,2,-0.3684,negative,212547,Twitter,"For all of the political hacks out there, if I hadn’t done my job well, & early, we would have lost 1 1/2 to 2 Million People, as opposed to the 100,000 plus that looks like will be the number. That’s 15 to 20 times more than we will lose. I shut down entry from China very early!",2991.77,President — 1st Term (2017–2021),In Office,1.4827,101482.73,2.9765,102976.5,3.0748,103074.77
2020-05-27,2020-05-27,tariffs_china,Tariffs & China,sp500,2,-0.271,negative,351395,Twitter,"We have informed both India and China that the United States is ready, willing and able to mediate or arbitrate their now raging border dispute. Thank you!",3036.1299,President — 1st Term (2017–2021),In Office,-0.2108,99789.21,2.8569,102856.93,-0.8919,99108.08
2020-05-28,2020-05-28,tariffs_china,Tariffs & China,sp500,1,-0.7573,negative,354908,Twitter,"All over the World the CoronaVirus, a very bad “gift” from China, marches on. Not good!",3029.73,President — 1st Term (2017–2021),In Office,0.4812,100481.23,2.727,102726.98,0.776,100775.98
2020-05-29,2020-05-29,tariffs_china,Tariffs & China,sp500,3,-0.2288,negative,1424945,Twitter,CHINA!,3044.3101,President — 1st Term (2017–2021),In Office,0.3751,100375.12,4.9147,104914.74,0.2933,100293.33
2020-05-30,2020-06-01,tariffs_china,Tariffs & China,sp500,1,-0.9648,negative,230311,Twitter,"Here we go again. Fake News @CNN is blaming RUSSIA, RUSSIA, RUSSIA. They are sick losers with VERY bad ratings! P.S. Can’t blame China because they need the cash?",3055.73,President — 1st Term (2017–2021),In Office,0.0,100000.0,5.7813,105781.27,-0.0815,99918.51
2020-06-01,2020-06-01,sp500,S&P 500,sp500,1,0.792,positive,211589,Twitter,“I don’t see any indication that there were any white supremest groups mixing in. This is an ANTIFA Organization. It seems that the first time we saw it in a major way was Occupy Wall Street. It’s the same mindset.” @kilmeade @foxandfriends TRUE!,3055.73,President — 1st Term (2017–2021),In Office,0.8211,100821.08,5.7813,105781.27,1.9678,101967.78
2020-06-04,2020-06-04,sp500,S&P 500,sp500,1,0.8253,positive,294153,Twitter,"I feel more and more confident that our economy is in the early stages of coming back very strong. Not everyone agrees with me, but I have little doubt. Watch for September, October, November. Next year will be one of the best ever, and look at the Stock Market NOW!",3112.3501,President — 1st Term (2017–2021),In Office,2.6212,102621.16,-3.5423,96457.66,2.1646,102164.6
2020-06-07,2020-06-08,israel_mideast,Israel & Middle East,sp500,1,-0.8932,negative,274478,Twitter,"Colin Powell, a real stiff who was very responsible for getting us into the disastrous Middle East Wars, just announced he will be voting for another stiff, Sleepy Joe Biden. Didn’t Powell say that Iraq had “weapons of mass destruction?” They didn’t, but off we went to WAR!",3232.3899,President — 1st Term (2017–2021),In Office,0.0,100000.0,-5.1293,94870.67,-2.6937,97306.33
2020-06-08,2020-06-08,sp500,S&P 500,sp500,1,0.8016,positive,208438,Twitter,"Big day for Stock Market. Smart money, and the World, know that we are heading in the right direction. Jobs coming back FAST. Next year will be our greatest ever!",3232.3899,President — 1st Term (2017–2021),In Office,-0.7799,99220.08,-5.1293,94870.67,-1.932,98067.99
2020-06-09,2020-06-09,sp500,S&P 500,sp500,1,0.0,neutral,212628,Twitter,NASDAQ HITS ALL-TIME HIGH!,3207.1799,President — 1st Term (2017–2021),In Office,-0.5313,99468.69,-2.5705,97429.52,-1.719,98281.05
2020-06-10,2020-06-10,sp500,S&P 500,sp500,1,0.5244,positive,208254,Twitter,"NASDAQ HITS ALL-TIME HIGH. Tremendous progress being made, way ahead of schedule. USA!",3190.1399,President — 1st Term (2017–2021),In Office,-5.8944,94105.59,-2.4027,97597.29,-0.1599,99840.14
2020-06-11,2020-06-11,fed_rates,Fed & Interest Rates,sp500,1,0.9115,positive,157258,Twitter,"The Federal Reserve is wrong so often. I see the numbers also, and do MUCH better than they do. We will have a very good Third Quarter, a great Fourth Quarter, and one of our best ever years in 2021. We will also soon have a Vaccine & Therapeutics/Cure. That’s my opinion. WATCH!",3002.1001,President — 1st Term (2017–2021),In Office,1.3061,101306.09,3.772,103772.03,5.1004,105100.43
2020-06-12,2020-06-12,tariffs_china,Tariffs & China,sp500,1,-0.4724,negative,90945,Twitter,"How do you think China, Russia, Japan or others would do with him in a negotiation? We would have no Country left!!! https://twitter.com/RichardGrenell/status/1271131885201022976 …",3041.3101,President — 1st Term (2017–2021),In Office,0.8312,100831.22,1.8554,101855.45,3.7454,103745.42
2020-06-13,2020-06-15,tariffs_china,Tariffs & China,sp500,1,-0.8827,negative,54201,Twitter,We are getting the Commercial Fishing Industry in Maine back on track (will be better than ever) after suffering years of stupidity and abuse from the previous administration. Already got 5000 square miles back and available to fish. China & E.U. told to drop their Tariffs now!!! https://twitter.com,3066.5901,President — 1st Term (2017–2021),In Office,0.0,100000.0,1.6719,101671.89,2.8902,102890.18
2020-06-16,2020-06-16,sp500,S&P 500,sp500,1,0.8475,positive,263099,Twitter,"Wow! May retail sales show biggest one-month increase of ALL TIME, up 17.7%. Far bigger than projected. Looks like a BIG DAY FOR THE STOCK MARKET, AND JOBS!",3124.74,President — 1st Term (2017–2021),In Office,-0.36,99639.97,0.2096,100209.62,2.9068,102906.81
2020-06-18,2020-06-18,tariffs_china,Tariffs & China,sp500,1,0.8431,positive,102313,Twitter,"It was not Ambassador Lighthizer’s fault (yesterday in Committee) in that perhaps I didn’t make myself clear, but the U.S. certainly does maintain a policy option, under various conditions, of a complete decoupling from China. Thank you!",3115.3401,President — 1st Term (2017–2021),In Office,-0.5649,99435.05,-1.0137,98986.3,4.3815,104381.54
2020-06-19,2020-06-19,tariffs_china,Tariffs & China,sp500,1,0.4278,positive,102625,Twitter,"The Democrats are doing totally false advertising. They have done NOTHING for years, including when Sleepy Joe was V.P., and they now have a Fake ad that my China Deal is losing us jobs. Opposite, & China is paying us $BILLIONS. Also, I LOVE Seniors & protect Preexisting C’s.",3097.74,President — 1st Term (2017–2021),In Office,0.6495,100649.51,-2.8631,97136.94,4.9746,104974.6
2020-06-23,2020-06-23,tariffs_china,Tariffs & China,sp500,2,0.7341,positive,281117,Twitter,"We did a great job on CoronaVirus, including the very early ban on China, Ventilator production, and Testing, which is by far the most, and best, in the World. We saved millions of U.S. lives.! Yet the Fake News refuses to acknowledge this in a positive way. But they do give....",3131.29,President — 1st Term (2017–2021),In Office,-2.5855,97414.49,-0.99,99009.99,3.3331,103333.13
2020-06-24,2020-06-24,tariffs_china,Tariffs & China,sp500,1,-0.5972,negative,193088,Twitter,"Biden failed with China. They took us to the cleaners! I got $Billions out of China, and gave much of it to our targeted farmers!",3050.3301,President — 1st Term (2017–2021),In Office,1.0959,101095.94,2.1483,102148.29,5.4191,105419.08
2020-06-30,2020-06-30,tariffs_china,Tariffs & China,sp500,1,-0.8988,negative,361214,Twitter,"As I watch the Pandemic spread its ugly face all across the world, including the tremendous damage it has done to the USA, I become more and more angry at China. People can see it, and I can feel it!",3100.29,President — 1st Term (2017–2021),In Office,0.5022,100502.21,1.4524,101452.45,4.707,104706.98
2020-07-01,2020-07-01,sp500,S&P 500,sp500,1,0.8405,positive,106985,Twitter,"WOW. Record Growth in 2nd Quarter! Under Corrupt Joe Biden and his MASSIVE Tax and Regulation increases, Markets, and your 401k’s, will PLUNGE! Expect a Record 2021!",3115.8601,President — 1st Term (2017–2021),In Office,0.4541,100454.13,1.7356,101735.63,4.9829,104982.89
2020-07-05,2020-07-06,tariffs_china,Tariffs & China,sp500,1,-0.5255,negative,330117,Twitter,"New China Virus Cases up (because of massive testing), deaths are down, “low and steady”. The Fake News Media should report this and also, that new job numbers are setting records!",3179.72,President — 1st Term (2017–2021),In Office,0.0,100000.0,-0.7705,99229.49,3.9875,103987.46
2020-07-06,2020-07-06,tariffs_china,Tariffs & China,sp500,5,-0.3007,negative,1310901,Twitter,China has caused great damage to the United States and the rest of the World!,3179.72,President — 1st Term (2017–2021),In Office,-1.0819,98918.15,-0.7705,99229.49,4.6561,104656.07
2020-07-07,2020-07-07,tariffs_china,Tariffs & China,sp500,1,-0.6181,negative,239261,Twitter,"“COVID-19 (China Virus) Death Rate PLUNGES From Peak In U.S.” A Tenfold Decrease In Mortality. The Washington Times @WashTimes Valerie Richardson. We have the lowest Mortality Rate in the World. The Fake News should be reporting these most important of facts, but they don’t!",3145.3201,President — 1st Term (2017–2021),In Office,0.7827,100782.74,1.6596,101659.61,6.4807,106480.73
2020-07-08,2020-07-08,sp500,S&P 500,sp500,1,0.8456,positive,172829,Twitter,"Economy and Jobs are growing MUCH faster than anyone (except me!) expected. Job growth is biggest in history. China Virus Mortality Rate is among the LOWEST of any country. Shaping up for a good third quarter, and a great next year! NASDAQ at new record high, 401k’s way up!!!!",3169.9399,President — 1st Term (2017–2021),In Office,-0.5644,99435.64,1.7862,101786.16,5.7206,105720.62
2020-07-13,2020-07-13,sp500,S&P 500,sp500,1,0.7365,positive,183788,Twitter,The Lamestream Media is not talking about what is happening with the Stock Market and JOBS. Both are doing GREAT! The Radical Left will destroy the USA. Be careful what you wish for!,3155.22,President — 1st Term (2017–2021),In Office,1.3406,101340.64,3.0622,103062.23,7.1352,107135.16
2020-07-20,2020-07-20,tariffs_china,Tariffs & China,sp500,1,0.4753,positive,375179,Twitter,"We are United in our effort to defeat the Invisible China Virus, and many people say that it is Patriotic to wear a face mask when you can’t socially distance. There is nobody more Patriotic than me, your favorite President! pic.twitter.com/iQOd1whktN",3251.8401,President — 1st Term (2017–2021),In Office,0.1679,100167.9,-0.3823,99617.75,3.7828,103782.78
2020-07-21,2020-07-21,sp500,S&P 500,sp500,1,0.5983,positive,175697,Twitter,Strong Stock Market Numbers. You want to see them dive? Vote for the Radical Left with their BIG Tax Hikes!,3257.3,President — 1st Term (2017–2021),In Office,0.5747,100574.71,-1.193,98806.98,3.9361,103936.08
2020-07-26,2020-07-27,tariffs_china,Tariffs & China,sp500,2,0.073,positive,372218,Twitter,"Crazy Nancy Pelosi said I made a mistake when I banned people from infected China from entering the U.S. in January. Tens of thousands of lives were saved, as she danced in the Streets of Chinatown (SF) in late February. Biden agreed with her, but soon admitted that I was right!",3239.4099,President — 1st Term (2017–2021),In Office,0.0,100000.0,1.704,101704.02,6.3039,106303.93
2020-07-30,2020-07-30,tariffs_china,Tariffs & China,sp500,1,-0.774,negative,105242,Twitter,"Major China Virus flare ups in many of the countries that the Fake News was touting as doing so well. Some of these countries are now a disaster. Lamestream Media doesn’t want to report this. Also, highly inaccurate numbers being reported by many other countries!!! @WSJ",3246.22,President — 1st Term (2017–2021),In Office,0.767,100767.05,3.1711,103171.07,7.8273,107827.26
2020-07-31,2020-07-31,tariffs_china,Tariffs & China,sp500,1,-0.9067,negative,182616,Twitter,"Pelosi & Schumer blocked desperately needed unemployment payments, which is so terrible, especially since they fully understand that it was not the workers fault that they are unemployed, it's the fault of China!",3271.1201,President — 1st Term (2017–2021),In Office,0.7181,100718.1,2.4505,102450.53,7.0065,107006.47
2020-08-01,2020-08-03,sp500,S&P 500,sp500,1,-0.8087,negative,142381,Twitter,"""Biden to raise taxes by 3 Trillion Dollars."" Actually, it will be much more than that, and much of it on nonsense. Markets and your 401k's will CRASH. Jobs will disappear!",3294.6101,President — 1st Term (2017–2021),In Office,0.0,100000.0,1.999,101999.02,6.2435,106243.53
2020-08-02,2020-08-03,tariffs_china,Tariffs & China,sp500,1,0.5983,positive,96164,Twitter,"Big China Virus breakouts all over the World, including nations which were thought to have done a great job. The Fake News doesn't report this. USA will be stronger than ever before, and soon! https://t.co/pZwjvgmVTO",3294.6101,President — 1st Term (2017–2021),In Office,0.0,100000.0,1.999,101999.02,7.043,107043.01
2020-08-03,2020-08-03,tariffs_china,Tariffs & China,sp500,3,-0.379,negative,435964,Twitter,"RECORD HIGH NASDAQ! It would all come crashing down, including your Jobs, Stocks, and 401k's, if Sleepy Joe ever became President. China and others would own us!!!",3294.6101,President — 1st Term (2017–2021),In Office,0.3612,100361.19,1.999,101999.02,8.6878,108687.83
2020-08-04,2020-08-04,sp500,S&P 500,sp500,1,-0.6249,negative,96623,Twitter,"THE WALL STREET JOURNAL ""Trump Wins in Portland"" ""Something big has changed in Portland, Ore. After weeks of chaos and flames outside the city's federal courthouse, the past few days have seen the violence subside dramatically. What happened?"" William McGurn @WSJ",3306.51,President — 1st Term (2017–2021),In Office,0.643,100642.97,0.822,100822.01,4.4927,104492.66
2020-08-07,2020-08-07,tariffs_china,Tariffs & China,sp500,2,-0.2454,negative,400278,Twitter,Pelosi and Schumer only interested in Bailout Money for poorly run Democrat cities and states. Nothing to do with China Virus! Want one trillion dollars. No interest. We are going a different way!,3351.28,President — 1st Term (2017–2021),In Office,0.2742,100274.22,0.6436,100643.64,-0.5801,99419.93
2020-08-08,2020-08-10,sp500,S&P 500,sp500,1,-0.8283,negative,208581,Twitter,"Sleepy Joe Biden just agreed with the Radical Left Democrats to raise Taxes by Three Trillion Dollars. Everyone will pay - Will kill your Stocks, 401k’s, and the ECONOMY. BIG CRASH! #MAGA",3360.47,President — 1st Term (2017–2021),In Office,0.0,100000.0,0.6404,100640.39,-0.852,99148.04
2020-08-11,2020-08-11,sp500,S&P 500,sp500,1,0.0,neutral,242831,Twitter,Big Stock Market Numbers!,3333.6899,President — 1st Term (2017–2021),In Office,1.3997,101399.66,1.6825,101682.52,0.165,100164.98
2020-08-13,2020-08-13,israel_mideast,Israel & Middle East,sp500,2,0.8246,positive,541571,Twitter,"HUGE breakthrough today! Historic Peace Agreement between our two GREAT friends, Israel and the United Arab Emirates!",3373.4299,President — 1st Term (2017–2021),In Office,-0.0172,99982.81,0.3581,100358.1,0.2997,100299.7
2020-08-18,2020-08-18,sp500,S&P 500,sp500,1,0.8687,positive,128735,Twitter,"....My Administration and I built the greatest economy in history, of any country, turned it off, saved millions of lives, and now am building an even greater economy than it was before. Jobs are flowing, NASDAQ is already at a record high, the rest to follow. Sit back & watch!",3389.78,President — 1st Term (2017–2021),In Office,-0.4404,99559.56,1.5883,101588.31,-0.9667,99033.27
2020-08-23,2020-08-24,tariffs_china,Tariffs & China,sp500,1,-0.9006,negative,156040,Twitter,"Chris Wallace ""forgot"" to ask a very weak and pathetic Schumer puppet, Senator Chrisie Coons, why Biden fought me when I put an extremely early BAN on people coming into our Country from heavily infected China. Biden later admitted I was right! But why no question?",3431.28,President — 1st Term (2017–2021),In Office,0.0,100000.0,2.0118,102011.79,-3.3722,96627.79
2020-08-24,2020-08-24,sp500,S&P 500,sp500,1,-0.5767,negative,289820,Twitter,"Joe Biden has said he would lock down the Country again. That's crazy! We're having record job growth and a booming stock market, but Joe would end it all and close it all down. Ridiculous!",3431.28,President — 1st Term (2017–2021),In Office,0.3596,100359.64,2.0118,102011.79,-5.6644,94335.64
2020-08-25,2020-08-25,tariffs_china,Tariffs & China,sp500,1,0.8962,positive,145711,Twitter,Beautiful Maine Lobsters will now move tariff-free to Europe! For first time in many years. GREAT new deal by USTR levels playing field with Canada. Millions of $’s more in EXPORTS...,3443.6201,President — 1st Term (2017–2021),In Office,1.0196,101019.56,2.4111,102411.12,-5.7216,94278.4
2020-08-26,2020-08-26,sp500,S&P 500,sp500,1,0.2404,positive,264950,Twitter,"Just In: Chinese State Media and Leaders of CHINA want Biden to win “the U.S. Election”. If this happened (which it won’t), China would own our Country, and our Record Setting Stock Markets would literally CRASH!",3478.73,President — 1st Term (2017–2021),In Office,0.1673,100167.3,2.9353,102935.27,-5.1821,94817.94
2020-08-30,2020-08-31,tariffs_china,Tariffs & China,sp500,1,0.4179,positive,60594,Twitter,"Probably Shifty Schiff, but others also, LEAK information to the Fake News. No matter what or who it is about, including China, these deranged lowlifes like the Russia, Russia, Russia narrative. Plays better for them. @DNI_Ratcliffe doing a great job! https://twitter.com/thehill/status/1299823611151",3500.3101,President — 1st Term (2017–2021),In Office,0.0,100000.0,-4.813,95187.0,-4.7093,95290.7
2020-09-03,2020-09-03,tariffs_china,Tariffs & China,sp500,3,-0.8767,negative,461023,Twitter,"Governors Andrew Cuomo of New York has the worst record on death and China Virus. 11,000 people alone died in Nursing Homes because of his incompetence!",3455.0601,President — 1st Term (2017–2021),In Office,-0.8133,99186.7,-3.3536,96646.36,-1.3447,98655.31
2020-09-04,2020-09-04,israel_mideast,Israel & Middle East,sp500,2,0.8525,positive,305262,Twitter,Another great day for peace with Middle East – Muslim-majority Kosovo and Israel have agreed to normalize ties and establish diplomatic relations. Well-done! More Islamic and Arab nations will follow soon!,3426.96,President — 1st Term (2017–2021),In Office,-2.7756,97224.37,-2.5092,97490.78,-0.5357,99464.25
2020-09-05,2020-09-08,tariffs_china,Tariffs & China,sp500,1,0.7401,positive,228802,Twitter,"Nancy Pelosi said she got ""set up"" by the owner (a very good one) of a beauty parlor. If so, how will she do in negotiations against President Xi of China, President Putin of Russia, or Kim Jong Un of North Korea. Not so well, I suspect, but far better than Joe Hiden' would do!",3331.8401,President — 1st Term (2017–2021),In Office,0.0,100000.0,1.5517,101551.69,2.3038,102303.83
2020-09-07,2020-09-08,tariffs_china,Tariffs & China,sp500,2,0.318,positive,198010,Twitter,"Starting to get VERY high marks in our handling of the Coronavirus (China Virus), especially when compared to other countries and areas of the world. Now the Vaccines (Plus) are coming, and fast!",3331.8401,President — 1st Term (2017–2021),In Office,0.0,100000.0,1.5517,101551.69,2.6292,102629.17
2020-09-08,2020-09-08,tariffs_china,Tariffs & China,sp500,2,0.0554,positive,222524,Twitter,"Because of the China Virus, my Campaign, which has raised a lot of money, was forced to spend in order to counter the Fake News reporting about the way we handled it (China Ban, etc.). We did, and are doing, a GREAT job, and have a lot of money left over, much more than 2016....",3331.8401,President — 1st Term (2017–2021),In Office,2.0145,102014.5,2.0817,102081.73,3.4512,103451.25
2020-09-09,2020-09-09,israel_mideast,Israel & Middle East,sp500,1,0.7783,positive,139691,Twitter,Trump nominated for Nobel Peace Prize following Israel-UAE accord https://t.co/hYElcJX9j6 via @nypost,3398.96,President — 1st Term (2017–2021),In Office,-1.7585,98241.52,-0.3963,99603.7,2.3001,102300.11
2020-09-11,2020-09-11,israel_mideast,Israel & Middle East,sp500,2,0.69,positive,491940,Twitter,Another HISTORIC breakthrough today! Our two GREAT friends Israel and the Kingdom of Bahrain agree to a Peace Deal – the second Arab country to make peace with Israel in 30 days!,3340.97,President — 1st Term (2017–2021),In Office,1.2742,101274.18,-0.6435,99356.47,5.7842,105784.25
2020-09-13,2020-09-14,tariffs_china,Tariffs & China,sp500,1,0.9624,positive,170075,Twitter,"I am running for re-election to bring prosperity to Nevada, to put violent criminals behind bars, and to ensure the future belongs to AMERICA—NOT China. If we win, AMERICA WINS! If Biden wins, China wins. If Biden Wins, the rioters, anarchists, and arsonists win. VOTE! #MAGA",3383.54,President — 1st Term (2017–2021),In Office,0.0,100000.0,-3.0288,96971.22,3.7945,103794.54
2020-09-14,2020-09-14,sp500,S&P 500,sp500,1,0.9199,positive,162009,Twitter,"Great, Just Out! 51% Approval Rating in Rasmussen Poll. 95% in Republican Party. Stock Market up BIG today. Will I ever be given credit for the Markets and Economy? Next year will be BIG!",3383.54,President — 1st Term (2017–2021),In Office,0.5219,100521.94,-3.0288,96971.22,3.1071,103107.1
2020-09-15,2020-09-15,israel_mideast,Israel & Middle East,sp500,3,0.8868,positive,395044,Twitter,"After decades of division and conflict, we mark the dawn of a new Middle East. Congratulations to the people of Israel, the people of the United Arab Emirates, and the people of the Kingdom of Bahrain. God Bless You All! https://t.co/gpeqFDtr0S",3401.2,President — 1st Term (2017–2021),In Office,-0.4619,99538.1,-2.5176,97482.36,2.415,102415.03
2020-09-16,2020-09-16,tariffs_china,Tariffs & China,sp500,2,-0.4204,negative,269972,Twitter,"Democrats are ""heartless"". They don't want to give STIMULUS PAYMENTS to people who desperately need the money, and whose fault it was NOT that the plague came in from China. Go for the much higher numbers, Republicans, it all comes back to the USA anyway (one way or another!).",3385.49,President — 1st Term (2017–2021),In Office,-0.8412,99158.76,-4.3884,95611.56,2.9042,102904.16
