event_date,buy_date,topic,topic_display,instrument,post_count,avg_sentiment,sentiment_label,total_engagement,platform,headline_text,buy_price,presidency_era,in_office,return_1d_pct,value_1d,return_1w_pct,value_1w,return_1m_pct,value_1m
2024-01-06,2024-01-08,tariffs_china,Tariffs & China,sp500,1,-0.9881,negative,13133,Truth Social,"The stakes of this election could not be higher. Under Crooked Joe Biden, our borders have been erased. Millions of illegal aliens are invading from all over the world. Our Middle Class is being crushed by Biden’s crippling inflation. Violent criminals are running wild in Democrat-run cities while l",4763.54,Not President (2021–2024),Not In Office,0.0,100000.0,0.0512,100051.22,3.7634,103763.38
2024-01-09,2024-01-09,fed_rates,Fed & Interest Rates,sp500,1,-0.9607,negative,9696,Truth Social,"This USA is in serious trouble. Under Crooked Joe Biden, our borders are GONE. Inflation is crushing our Middle Class. Violent criminals are running wild. Law enforcement is weaponized against conservatives and Christians. Our military has gone woke, the world is on fire, and we are stumbling toward",4756.5,Not President (2021–2024),Not In Office,0.5666,100566.6,0.1993,100199.31,5.0754,105075.37
2024-01-12,2024-01-12,israel_mideast,Israel & Middle East,sp500,3,-0.6918,negative,50679,Truth Social,"So, let me get this straight. We’re dropping bombs all over the Middle East, AGAIN (where I defeated ISIS!), and our Secretary of Defence, who just went missing for five days, is running the war from his laptop in a hospital room. Remember, this is the same gang that “surrendered” in Afghanistan, wh",4783.8301,Not President (2021–2024),Not In Office,-0.3731,99626.87,1.1702,101170.19,4.9753,104975.3
2024-01-15,2024-01-16,israel_mideast,Israel & Middle East,sp500,1,0.8411,positive,42955,Truth Social,"So interesting to watch anti-Israel protesters violently demonstrating at the While House, getting close to tearing down the fences that protect the President, and NOTHING is even mentioned about it in the LameStream Media, which is merely a subsidiary of the Democrat Party. No arrests, no nothing. ",4765.98,Not President (2021–2024),Not In Office,0.0,100000.0,1.7719,101771.94,4.9232,104923.23
2024-01-16,2024-01-16,tariffs_china,Tariffs & China,sp500,1,-0.9458,negative,18920,Truth Social,"Americans for Chinese Prosperity, a RINO Charles Koch con job that is funding, along with many Democrats and others that aren’t feeling so well right now, is very embarrassed by the poor showing of Nikki “Birdbrain” Haley in yesterday’s Iowa Primary. She placed a distant THIRD, after spending millio",4765.98,Not President (2021–2024),Not In Office,-0.5617,99438.31,2.0693,102069.25,5.534,105534.01
2024-01-19,2024-01-19,tariffs_china,Tariffs & China,sp500,1,0.9681,positive,14761,Truth Social,"Governor Chris Sununu, the now failing Governor of New Hampshire, where I am beating his endorsed candidate, Nimbra, by big numbers, and DeSanctimonious by even bigger numbers, should spend more time keeping Democrats from voting in the Republican Primary - How ridiculous is that? Anyway, it doesn’t",4839.8101,Not President (2021–2024),Not In Office,0.2194,100219.43,1.0571,101057.07,2.8038,102803.82
2024-01-21,2024-01-22,israel_mideast,Israel & Middle East,sp500,1,0.0,neutral,15167,Truth Social,THE MIDDLE EAST IS BLOWING UP AGAIN. HERE WE GO!!!,4850.4302,Not President (2021–2024),Not In Office,0.0,100000.0,1.5978,101597.8,2.5787,102578.73
2024-01-23,2024-01-23,fed_rates,Fed & Interest Rates,sp500,1,0.9816,positive,16974,Truth Social,"The level of Excitement and Enthusiasm in New Hampshire is incredible. They want STRONG BORDERS, A GREAT ECONOMY WITH NO INFLATION, LOW TAXES & REGULATIONS, A POWERFUL MILITARY, ENERGY INDEPENDENCE, & JUST PLAIN COMMON SENSE. WE WILL MAKE AMERICA GREAT AGAIN!",4864.6001,Not President (2021–2024),Not In Office,0.0812,100081.19,1.241,101241.01,4.5724,104572.41
2024-01-28,2024-01-29,israel_mideast,Israel & Middle East,sp500,1,-0.9623,negative,26315,Truth Social,"Page Two: Three years ago, Iran was weak, broke, and totally under control. Thanks to my Maximum Pressure policy, the Iranian Regime could barely scrape two dollars together to fund their terrorist proxies. Then Joe Biden came in and gave Iran billions of dollars, which the Regime has used to spread",4927.9302,Not President (2021–2024),Not In Office,0.0,100000.0,0.302,100301.95,3.0489,103048.95
2024-01-29,2024-01-29,tariffs_china,Tariffs & China,sp500,2,0.7366,positive,62821,Truth Social,"I had the great privilege of watching Shawn Fain, the President of the United Auto Workers, this morning on DeFace the Nation. He is a real “STIFF” who is selling the Automobile Industry right into the big, powerful, hands of China. 55% of the industry has already left the U.S., and the rest will so",4927.9302,Not President (2021–2024),Not In Office,-0.0601,99939.93,0.302,100301.95,2.8781,102878.08
2024-01-31,2024-01-31,israel_mideast,Israel & Middle East,sp500,2,-0.0686,negative,47997,Truth Social,Three years ago we had PEACE IN THE MIDDLE EAST!,4845.6499,Not President (2021–2024),Not In Office,1.2494,101249.37,3.0834,103083.39,6.0143,106014.26
2024-02-10,2024-02-12,sp500,S&P 500,sp500,1,-0.7678,negative,11145,Truth Social,"Nikki may have started her career in South Carolina, but she is now 100% the candidate of Wall Street and the war machine!",5021.8398,Not President (2021–2024),Not In Office,0.0,100000.0,-0.9226,99077.43,1.9136,101913.64
2024-02-19,2024-02-20,tariffs_china,Tariffs & China,sp500,1,-0.5573,negative,25166,Truth Social,"MY FINANCIAL STATEMENTS WERE UNDERSTATED, NOT OVERSTATED! THAT IS WHY THE CROOKED, HAND PICKED JUDGE, SAID THAT MAR-a-LAGO, IN PALM BEACH, FLORIDA, WAS ONLY WORTH $18,000,000, WHEN IT IS WORTH 50 TO 100 TIMES THAT AMOUNT. OTHER PROPERTIES ALSO! THEY DIDN’T EVEN INCLUDE “BRAND VALUE,” KNOWN AND ACCEP",4975.5098,Not President (2021–2024),Not In Office,0.0,100000.0,1.8897,101889.66,5.0067,105006.73
2024-02-20,2024-02-20,fed_rates,Fed & Interest Rates,sp500,1,0.8906,positive,12786,Truth Social,"Speaker Tim Moore is doing a fantastic job leading the North Carolina House of Representatives, and he is now running to represent the Wonderful People of North Carolina’s 14th Congressional District. As your next Congressman, Tim will work hard to Secure the Border, Stop Inflation, Strengthen our M",4975.5098,Not President (2021–2024),Not In Office,0.1264,100126.42,2.0635,102063.52,5.3466,105346.59
2024-02-27,2024-02-27,fed_rates,Fed & Interest Rates,sp500,1,0.9691,positive,25604,Truth Social,"It is my great honor to ENDORSE Brandon Gill for U.S. Congress in Texas-26. He is the clear “America First” candidate, and is as loyal and tough as they come. He’s a Cowboy, Businessman, Husband and Father, but also, a True Patriot. Brandon is Strong on SECURING OUR BORDER, STOPPING CRIME, FIGHTING ",5078.1802,Not President (2021–2024),Not In Office,-0.1658,99834.18,0.0092,100009.25,3.4692,103469.15
2024-02-29,2024-02-29,tariffs_china,Tariffs & China,sp500,1,-0.9423,negative,9020,Truth Social,"Americans for Chinese Prosperity, No Action, the Charles Koch run Political Disaster, has given up on Nikki Haley, who has lost every race against me, receiving Record Low Numbers. Next week, she will lose all of the Super Tuesday States. She’s got no traction, no people watching, no “nothing,” and ",5096.27,Not President (2021–2024),Not In Office,0.8008,100800.78,1.1987,101198.72,2.8943,102894.27
2024-03-02,2024-03-04,fed_rates,Fed & Interest Rates,sp500,2,0.9298,positive,15577,Truth Social,"Great Speech at Rally, Tim! Speaker Tim Moore is doing a fantastic job leading the North Carolina House of Representatives, and he is now running to represent the Wonderful People of North Carolina’s 14th Congressional District. As your next Congressman, Tim will work hard to Secure the Border, Stop",5130.9502,Not President (2021–2024),Not In Office,0.0,100000.0,-0.2536,99746.43,2.1988,102198.81
2024-03-03,2024-03-04,tariffs_china,Tariffs & China,sp500,1,0.0,neutral,12352,Truth Social,https:// thenationalpulse.com/2024/02/2 9/bombshell-hunter-confirms-joe-biden-is-the-big-guy-in-laptop-from-hell-china-e-mails/,5130.9502,Not President (2021–2024),Not In Office,0.0,100000.0,-0.2536,99746.43,1.459,101458.99
2024-03-04,2024-03-04,sp500,S&P 500,sp500,1,-0.7198,negative,14332,Truth Social,"Page 3: There was no trial and no jury for the supposed “wrongdoing” OF FULLY PAYING BACK SOPHISTICATED WALL STREET BANKS IN FULL, WITH INTEREST, WITH NO DEFAULTS, AND WITH NO VICTIMS. These Banks were represented by the largest, most sophisticated Law Firms in the Country. All Financial Statements ",5130.9502,Not President (2021–2024),Not In Office,-1.0193,98980.69,-0.2536,99746.43,1.5697,101569.69
2024-03-08,2024-03-08,fed_rates,Fed & Interest Rates,sp500,3,-0.1541,negative,94809,Truth Social,INFLATION UNDER BIDEN IS KILLING AMERICA!,5123.6899,Not President (2021–2024),Not In Office,-0.1122,99887.78,-0.1288,99871.18,1.536,101536.01
2024-03-11,2024-03-11,israel_mideast,Israel & Middle East,sp500,1,0.1511,positive,38832,Truth Social,"My first acts as your next President will be to Close the Border, DRILL, BABY, DRILL, and Free the January 6 Hostages being wrongfully imprisoned!",5117.9399,Not President (2021–2024),Not In Office,1.1202,101120.18,0.6151,100615.09,0.8343,100834.32
2024-03-12,2024-03-12,tariffs_china,Tariffs & China,sp500,2,0.4817,positive,33262,Truth Social,"Colorado Republican Party Chairman Dave Williams is running for Congress in Colorado’s 5th Congressional District. His opponent is Endorsed, and works closely with, Americans for Chinese Prosperity, a Charles Koch Disaster. Dave helped us deliver a 30-point Blowout Victory on Super Tuesday, and he w",5175.27,Not President (2021–2024),Not In Office,-0.1925,99807.55,0.0626,100062.6,0.4597,100459.69
2024-03-13,2024-03-13,sp500,S&P 500,sp500,1,0.9899,positive,57430,Truth Social,"It is my great honor to be representing the Republican Party as its Presidential Nominee. Our Party is UNITED and STRONG, and fully understands that we are running against the Worst, Most Incompetent, Corrupt, and Destructive President in the History of the United States. Millions of people are inva",5165.3101,Not President (2021–2024),Not In Office,-0.2871,99712.89,1.1482,101148.24,-0.8112,99188.82
2024-03-14,2024-03-14,tariffs_china,Tariffs & China,sp500,1,-0.3182,negative,10941,Truth Social,‘Blood Money’: The Biden Family Bagged $5M from Business Partner of ‘White Wolf’ Chinese Criminal Gang Leader Who Helped Create the Fentanyl Pipeline Decimating America:\n https://www. breitbart.com/politics/2024/02 /27/blood-money-how-the-biden-family-bagged-5m-from-business-partner-of-white-wolf-c,5150.48,Not President (2021–2024),Not In Office,-0.6483,99351.71,1.7678,101767.79,-1.7214,98278.6
2024-03-17,2024-03-18,tariffs_china,Tariffs & China,sp500,1,0.0,neutral,7005,Truth Social,https:// thenationalpulse.com/2024/03/1 2/revealed-biden-bragged-to-special-counsel-about-real-advantage-of-china-funded-penn-job-they-gave-me-money/,5149.4199,Not President (2021–2024),Not In Office,0.0,100000.0,1.3355,101335.49,-1.9033,98096.68
2024-03-18,2024-03-18,fed_rates,Fed & Interest Rates,sp500,2,0.6341,positive,25592,Truth Social,"Derek Merrin is an incredible America First Patriot who is running for Congress in Ohio’s 9th Congressional District against a RINO, Craig Riedel, who is no friend of MAGA. As your next Congressman, Derek will fight hard to Secure our Border, Stop Inflation, Support our Military / Vets, and Protect ",5149.4199,Not President (2021–2024),Not In Office,0.5649,100564.92,1.3355,101335.49,-2.4704,97529.63
2024-03-23,2024-03-25,tariffs_china,Tariffs & China,sp500,1,0.0,neutral,14451,Truth Social,https://www. newsweek.com/sorry-democrats-f ree-trade-republicans-trumps-tariffs-worked-opinion-1882297,5218.1899,Not President (2021–2024),Not In Office,0.0,100000.0,0.4902,100490.21,-3.9782,96021.8
2024-03-25,2024-03-25,sp500,S&P 500,sp500,1,0.4199,positive,22285,Truth Social,Will be having a News Conference at 40 Wall Street at 1 P.M. Thank you!,5218.1899,Not President (2021–2024),Not In Office,-0.28,99720.02,0.4902,100490.21,-2.8086,97191.36
2024-03-26,2024-03-26,fed_rates,Fed & Interest Rates,sp500,1,0.6319,positive,26664,Truth Social,"I’m not running to terminate the ACA, AS CROOKED JOE BUDEN DISINFORMATES AND MISINFORMATES ALL THE TIME, I’m running to CLOSE THE BORDER, STOP INFLATION, MAKE OUR ECONOMY GREAT, STRENGTHEN OUR MILITARY, AND MAKE THE ACA, or OBAMACARE, AS IT IS KNOWN, MUCH BETTER, STRONGER, AND FAR LESS EXPENSIVE. IN",5203.5801,Not President (2021–2024),Not In Office,0.8631,100863.06,0.0429,100042.86,-2.9818,97018.2
2024-03-31,2024-04-01,tariffs_china,Tariffs & China,sp500,1,0.0,neutral,7063,Truth Social,https://www. breitbart.com/politics/2024/03 /21/swing-state-democrats-agree-with-donald-trump-u-s-needs-aggressive-tariffs-on-china-made-cars/,5243.77,Not President (2021–2024),Not In Office,0.0,100000.0,-0.7891,99210.88,-3.9681,96031.86
2024-04-02,2024-04-02,tariffs_china,Tariffs & China,sp500,1,0.7762,positive,12253,Truth Social,"A TRUTH from Great Businessman Ike Perlmutter: ""It’s very sad and scary what they are doing to The President. Reminds me of Venezuela, Russia, China, 'banana republic,' and I hope they don’t get away with this. We can’t let this happen. Stay strong!""",5205.8101,Not President (2021–2024),Not In Office,0.1091,100109.11,0.0788,100078.76,-2.7202,97279.77
2024-04-04,2024-04-04,israel_mideast,Israel & Middle East,sp500,1,0.0,neutral,29896,Truth Social,January 6th hostages with President Donald J. Trump…,5147.21,Not President (2021–2024),Not In Office,1.1099,101109.92,1.0073,101007.34,0.6514,100651.42
2024-04-05,2024-04-05,israel_mideast,Israel & Middle East,sp500,1,-0.9623,negative,24054,Truth Social,"Rebecca Lavrez, also known as the “J6 Praying Grandma,” has been unfairly targeted by Crooked Joe Biden’s DOJ, and now faces up to 1 YEAR in prison for peacefully walking around the Capitol, and praying for our Failing Nation on January 6th! Rebecca is a 72-year-old Grandmother and Small Business Ow",5204.3398,Not President (2021–2024),Not In Office,-0.0375,99962.54,-1.555,98444.96,-0.4535,99546.54
2024-04-06,2024-04-08,sp500,S&P 500,sp500,1,0.3612,positive,19238,Truth Social,"""New report from the Wall Street Journal shows $100 at the grocery store just doesn't go as far as it did five years ago. Today, that same grocery list costs 36.5% more...Items like beef, fruit snacks, and mayonnaise are more than 50% more expensive than back in 2019.""",5202.3901,Not President (2021–2024),Not In Office,0.0,100000.0,-2.702,97297.97,-0.4162,99583.85
2024-04-07,2024-04-08,fed_rates,Fed & Interest Rates,sp500,1,0.8573,positive,21938,Truth Social,"After selling his highly successful Oil and Gas Business, Tony Wied has decided to run for Congress in Wisconsin’s 8th Congressional District. Tony is running against RINO Roger Roth, who is a “clone” of Paul Ryan, and no friend to MAGA - He should drop out of the Race NOW. As your next Congressman,",5202.3901,Not President (2021–2024),Not In Office,0.0,100000.0,-2.702,97297.97,-0.2824,99717.63
2024-04-08,2024-04-08,fed_rates,Fed & Interest Rates,sp500,2,-0.767,negative,37244,Truth Social,"People forget, fighting Roe v. Wade was, right from the beginning, all about bringing the Issue back to the States, pursuant to the 10th Amendment and States’ Rights. It wasn’t about anything else. After we won, Marjorie Dannenfelser of SBA, and Lindsey Graham, started saying, “No, let’s go back to ",5202.3901,Not President (2021–2024),Not In Office,0.1446,100144.55,-2.702,97297.97,-0.283,99717.05
2024-04-10,2024-04-10,fed_rates,Fed & Interest Rates,sp500,2,-0.3642,negative,45240,Truth Social,"INFLATION is BACK—and RAGING! The Fed will never be able to credibly lower interest rates, because they want to protect the worst President in the history of the Untied States!",5160.6401,Not President (2021–2024),Not In Office,0.7445,100744.48,-2.6824,97317.58,1.2022,101202.18
2024-04-12,2024-04-12,tariffs_china,Tariffs & China,sp500,3,0.0,neutral,18324,Truth Social,https://www. newsweek.com/sorry-democrats-f ree-trade-republicans-trumps-tariffs-worked-opinion-1882297,5123.4102,Not President (2021–2024),Not In Office,-1.2021,98797.86,-3.0484,96951.64,1.913,101912.98
2024-04-13,2024-04-15,israel_mideast,Israel & Middle East,sp500,4,0.0006,neutral,129994,Truth Social,ISRAEL IS UNDER ATTACK! This should never have been allowed to happen - This would NEVER have happened if I were President!,5061.8198,Not President (2021–2024),Not In Office,0.0,100000.0,-1.0119,98988.12,3.153,103153.02
2024-04-14,2024-04-15,israel_mideast,Israel & Middle East,sp500,1,0.2732,positive,21984,Truth Social,I want to say God Bless the people of Israel. They’re under attack right now…it would not have happened if we were in office…,5061.8198,Not President (2021–2024),Not In Office,0.0,100000.0,-1.0119,98988.12,3.6521,103652.05
2024-04-15,2024-04-15,israel_mideast,Israel & Middle East,sp500,2,-0.3491,negative,19438,Truth Social,Russia is now calling for RESTRAINT in the war with Israel and Iran — AN ALL TIME CLASSIC!!!,5061.8198,Not President (2021–2024),Not In Office,-0.2056,99794.35,-1.0119,98988.12,4.8664,104866.43
2024-04-16,2024-04-16,israel_mideast,Israel & Middle East,sp500,1,0.0,neutral,11366,Truth Social,https://www. dailymail.co.uk/news/article-1 3315885/Trump-Israel-Arab-alliance-Iran-attack-failed-ANDREW-NEIL.html,5051.4102,Not President (2021–2024),Not In Office,-0.5781,99421.94,0.3789,100378.9,4.8638,104863.79
2024-04-17,2024-04-17,tariffs_china,Tariffs & China,sp500,2,0.0,neutral,45094,Truth Social,The Crooked Joe Biden agenda taxes America to build up China. My agenda will tax China to BUILD UP AMERICA!,5022.21,Not President (2021–2024),Not In Office,-0.2208,99779.18,0.984,100984.03,5.5963,105596.34
2024-04-20,2024-04-22,tariffs_china,Tariffs & China,sp500,1,-0.7458,negative,14523,Truth Social,"REMEMBER, if I don’t have Presidential Immunity, then Crooked Joe Biden doesn’t have it either, and he would certainly be Prosecuted for his many ACTUAL CRIMES, including illegally receiving massive amounts of money from Foreign Countries, including China, Ukraine, and Russia, paying off Ukraine to ",5010.6001,Not President (2021–2024),Not In Office,0.0,100000.0,2.1069,102106.93,5.938,105938.01
2024-04-22,2024-04-22,israel_mideast,Israel & Middle East,sp500,5,0.1491,positive,79006,Truth Social,"The Palestinian Protests at Columbia University have CLOSED THE COLLEGE DOWN. But the area surrounding the Courthouse, in Downtown Manhattan, is closed up like a drum, with New York City’s Finest (Police) all over the place. Why not send some to Columbia to protect Jewish Students, and others. The U",5010.6001,Not President (2021–2024),Not In Office,1.1965,101196.46,2.1069,102106.93,5.9157,105915.65
2024-04-23,2024-04-23,tariffs_china,Tariffs & China,sp500,1,-0.9826,negative,25157,Truth Social,"The Dollar has just hit a 34 year high against the Yen, a total disaster for the United States. When I was President, I spent a good deal of time telling Japan and China, in particular, you can’t do that. It sounds good to stupid people, but it is a disaster for our manufacturers and others. They ar",5070.5498,Not President (2021–2024),Not In Office,0.0213,100021.3,-0.6875,99312.5,3.8909,103890.9
2024-04-24,2024-04-24,israel_mideast,Israel & Middle East,sp500,1,-0.9739,negative,19918,Truth Social,"Crooked Joe Biden would say, constantly, that he ran because of Charlottesville. Well, if that’s the case, he’s done a really terrible job because Charlottesville is like a “peanut” compared to the riots and anti-Israel protests that are happening all over our Country, RIGHT NOW….And it’s Crooked’s ",5071.6299,Not President (2021–2024),Not In Office,-0.4576,99542.36,-1.0498,98950.24,4.596,104595.96
2024-04-25,2024-04-25,fed_rates,Fed & Interest Rates,sp500,2,0.1103,positive,33798,Truth Social,"Steamfitters Local 638 manager: ""It was great to see the president come and engage with the blue collar worker of New York City...I put out a poll in my union, President Trump is leading Joe Biden 3 to 1...we are very tired of...inflation, gas prices, illegal immigration...""",5048.4199,Not President (2021–2024),Not In Office,1.0209,101020.92,0.3126,100312.58,5.103,105102.98
2024-04-26,2024-04-26,tariffs_china,Tariffs & China,sp500,1,0.2244,positive,27718,Truth Social,"LETTER TO JOE: Dear Joe, now that you’ve committed to Debate on the now dying Howard Stern Show, no less, let’s set it up right now. I’m ready to go anywhere that you are. We could do it in D.C., even pinpoint the White House, or in New York when your Radical Left Fascists are finished with ELECTION",5099.96,Not President (2021–2024),Not In Office,0.3178,100317.84,0.5457,100545.69,4.0408,104040.82
2024-04-27,2024-04-29,fed_rates,Fed & Interest Rates,sp500,1,0.9816,positive,17801,Truth Social,"Trent Staggs is 100% MAGA, and is running to fill The Mitt Romney, a Total Loser, Seat as the next Senator from the Great State of Utah! A Highly Successful Entrepreneur, who has served brilliantly as Mayor of Riverton for the past six years, Trent knows how to Create Jobs, Stop Inflation, Grow the ",5116.1699,Not President (2021–2024),Not In Office,0.0,100000.0,1.2621,101262.08,3.7112,103711.18
2024-04-28,2024-04-29,israel_mideast,Israel & Middle East,sp500,2,0.0,neutral,25365,Truth Social,https:// nypost.com/2024/04/26/us-news/ george-soros-maoist-fund-columbias-anti-israel-tent-city,5116.1699,Not President (2021–2024),Not In Office,0.0,100000.0,1.2621,101262.08,3.7112,103711.18
2024-04-29,2024-04-29,israel_mideast,Israel & Middle East,sp500,1,-0.744,negative,30755,Truth Social,"Israel will find, very sadly, that there are far fewer hostages than currently being thought. That’s why it’s hard for Hamas to make a deal - They are no longer able to produce the people, because many of them are gone. Hamas is incapable of holding Jewish people for a long period of time without ki",5116.1699,Not President (2021–2024),Not In Office,-1.5731,98426.95,1.2621,101262.08,2.9471,102947.13
2024-05-01,2024-05-01,fed_rates,Fed & Interest Rates,sp500,1,0.9492,positive,12157,Truth Social,"David Borrero, who is 100% MAGA and has been with us from the very beginning, is a Conservative Champion for Florida House, District 111! He sponsored the “Victims of Communism Education,” and is working tirelessly to protect our Constitutional Rights, stop Inflation, secure the Border, support our ",5018.3901,Not President (2021–2024),Not In Office,0.9128,100912.84,3.3732,103373.19,5.1634,105163.4
2024-05-06,2024-05-06,fed_rates,Fed & Interest Rates,sp500,1,0.5992,positive,20471,Truth Social,"“If you’re looking at the economy, we had very low inflation, virtually full employment, and for the first time in a generation, the lower income earners were catching up to people higher up in the food chain. The income inequality, the gap there, actually narrowed in the Trump years. We’ve never se",5180.7402,Not President (2021–2024),Not In Office,0.1343,100134.34,0.7852,100785.21,3.3449,103344.88
2024-05-07,2024-05-07,fed_rates,Fed & Interest Rates,sp500,1,0.9796,positive,15649,Truth Social,"Highly respected Senator Mike Braun is running for Governor of Indiana, a State I love and won by large margins in 2016 and 2020. In the Senate, Mike is working hard to support our Law Enforcement, secure our Borders, and stop the Woke Fascist Mob trying to destroy our Country. Mike is an America Fi",5187.7002,Not President (2021–2024),Not In Office,-0.0006,99999.42,1.1369,101136.92,3.1856,103185.61
2024-05-09,2024-05-09,israel_mideast,Israel & Middle East,sp500,2,-0.4487,negative,25942,Truth Social,"Crooked Joe Biden, whether he knows it or not, just said he will withhold weapons from Israel as they fight to eradicate Hamas Terrorists in Gaza. Hamas murdered thousands of innocent civilians, including babies, and are still holding Americans hostage, if the hostages are still alive. Yet Crooked J",5214.0801,Not President (2021–2024),Not In Office,0.1649,100164.94,1.5922,101592.23,2.8137,102813.73
2024-05-10,2024-05-10,israel_mideast,Israel & Middle East,sp500,1,-0.3595,negative,18999,Truth Social,Biden wants to immediately stop all aid to Israel. Any Jewish person who votes for Crooked Joe Biden should have his/her head examined!,5222.6802,Not President (2021–2024),Not In Office,-0.0241,99975.87,1.5431,101543.07,2.6444,102644.42
2024-05-11,2024-05-13,fed_rates,Fed & Interest Rates,sp500,1,0.9645,positive,12164,Truth Social,"We don't have to agree on everything, but we can agree that we want STRONG BORDERS…not open borders…We want the AMERICAN DREAM, not the BIDEN INFLATION NIGHTMARE…We want SAFE COMMUNITIES, not defund the police…",5221.4199,Not President (2021–2024),Not In Office,0.0,100000.0,1.6607,101660.66,2.6692,102669.2
2024-05-14,2024-05-14,tariffs_china,Tariffs & China,sp500,1,-0.8316,negative,18314,Truth Social,Victor Davis Hanson: “None of the five civil and criminal cases currently lodged against former President Donald Trump have ever had merit…These criminal and civil trials are merely the continuation of extra-legal efforts of the last eight years to destroy a presidential candidate in lieu of opposin,5246.6802,Not President (2021–2024),Not In Office,1.1716,101171.59,1.4243,101424.33,3.5653,103565.3
